review_id,review_snippet,score,pred_sentiment,action,summary,ner_locations,Discount_Code,true_sentiment,Rec_1_City,Rec_1_Country,Rec_1_Reason,Rec_1_Activities,Rec_2_City,Rec_2_Country,Rec_2_Reason,Rec_2_Activities,Rec_3_City,Rec_3_Country,Rec_3_Reason,Rec_3_Activities
a899a798-3cf9-48ff-a161-5c06041d546d,perfect stay tokyo look hiwe`ve stayed crowne 22-2...,4,positive,RECOMMENDATION,"The review highlights a perfect stay with efficient staff, a great location, and affordable dining options despite some ongoing renovations.","crowne, jakarta, tokyo",,positive,Krakow,Poland,RAG_Activity_Match,"Wawel Castle tour, Jewish Quarter visit",Frankfurt,Germany,RAG_Activity_Match,"Skyline tour, Museum Embankment visit",Casablanca,Morocco,RAG_Activity_Match,"Hassan II Mosque visit, Food tasting"
b0bb1b98-dc8e-45d8-9e67-77a96754c807,"superb truly wonderful hotel, arrived regular taxi...",5,positive,RECOMMENDATION,"The hotel offers superb service, a great location, and excellent amenities, making for a wonderful stay.",,,positive,Muscat,Oman,RAG_Activity_Match,"Sultan Qaboos Grand Mosque visit, Beach day",Monaco,Monaco,RAG_Activity_Match,"Casino visit, Yacht harbor tour",Doha,Qatar,RAG_Activity_Match,"Souq Waqif visit, Museum of Islamic Art"
df379cbc-0ead-484e-b101-aa397f07b2e8,n't bother stayed hotel just recently mother short...,1,negative,DISCOUNT,"The reviewer had a disappointing experience with the hotel due to small room size, poor breakfast quality, and issues with service, despite acknowledging friendly staff and a good location.",singapore,SORRY_2026,negative,,,,,,,,,,,,
434cc822-da24-4da2-885e-58f92374e1df,disappointing having agonised hotel book boyfriend...,2,negative,DISCOUNT,"The review expresses disappointment with the hotel's facilities and service, leading to a cancellation of the second night.",,SORRY_2026,negative,,,,,,,,,,,,
23ce4033-db14-4fb4-bd14-198a6a624af0,comfortable apt.-style hotel enjoyable stay price ...,4,positive,RECOMMENDATION,"The hotel offers a comfortable stay with good amenities and a responsive staff, despite some parking challenges.",inn shuttle,,positive,Rotterdam,Netherlands,RAG_Activity_Match,"Architecture tour, Harbor cruise",Bilbao,Spain,RAG_Activity_Match,"Guggenheim Museum visit, Food tasting",Bilbao,Spain,RAG_Activity_Match,"Guggenheim Museum visit, Pinxtos tour"
09b9f112-27c9-48f8-a39d-d3d46019d3b5,"ideal place stay great deal great location, hubby ...",4,positive,RECOMMENDATION,"The hotel offers a great location, friendly staff, and good value for money, making it a recommended choice for travelers.","barcelona, las, catalunya",,positive,Barcelona,Spain,NER_Location_Match,"City tour, Nightlife tour, Food tasting",Bilbao,Spain,RAG_Activity_Match,"Guggenheim Museum visit, Pinxtos tour",Granada,Spain,RAG_Activity_Match,"Alhambra visit, Flamenco show"
5cedfcc9-0d35-467c-80b7-ebcc5e9f437d,"best beijing superb hotel, stayed twice upgraded t...",5,positive,RECOMMENDATION,"The hotel offers a superb experience with helpful staff, immaculate rooms, and a great location near the Forbidden City.","hyatt, beijing, china",,positive,Bucharest,Romania,RAG_Activity_Match,"Palace of Parliament tour, Historic center visit",Frankfurt,Germany,RAG_Activity_Match,"Skyline tour, Museum Embankment visit",Dresden,Germany,RAG_Activity_Match,"Historic center walk, Art gallery visit"
b8ad5885-cefd-4181-af88-567713abd4ce,large familky vacation 23 family members travelled...,5,positive,RECOMMENDATION,The review describes a wonderful experience during the first week of the stay but highlights significant issues during the second week due to overcrowding and difficulties with reservations.,"new york, kids.i",,positive,Crete,Greece,RAG_Activity_Match,"Beach day, Cooking class",Limassol,Cyprus,RAG_Activity_Match,"Beach day, Castle visit",Mykonos,Greece,RAG_Activity_Match,"Beach parties, Boat excursion"
38c6d6ac-a7fa-4008-83a2-efc479c1a935,"horrific awful, appeared building site arrival gen...",1,negative,DISCOUNT,"The hotel experience was severely disappointing due to poor conditions, lack of amenities, and unsatisfactory service.",you__Ç_éÈe,SORRY_2026,negative,,,,,,,,,,,,
0dee9bf9-dd2d-4063-8de6-23bd3ea1ee45,good location nice room hotel currently going work...,3,positive,RECOMMENDATION,"The hotel offers a good location, clean and nicely decorated rooms, and a pleasant stay despite ongoing renovations.",china,,neutral,Hamburg,Germany,RAG_Activity_Match,"Harbor boat ride, Museum visit",Frankfurt,Germany,RAG_Activity_Match,"Skyline tour, Museum Embankment visit",Riyadh,Saudi Arabia,RAG_Activity_Match,"Historical sites, Desert excursion"
15520646-7504-4ce4-a77d-9315c25bacb6,"great choice, thanks trip advisor, travelled londo...",5,positive,RECOMMENDATION,The hotel provided a great experience with good quality accommodations and convenient transport links.,london,,positive,Frankfurt,Germany,RAG_Activity_Match,"Skyline tour, Museum Embankment visit",Bruges,Belgium,RAG_Activity_Match,"Canal cruise, Brewery visit",Brussels,Belgium,RAG_Activity_Match,"Chocolate tasting, Beer tour"
10224a37-50a2-4994-a06d-41aff80f99da,"steal money-beware, hotel completely disgusting, a...",1,negative,DISCOUNT,"The reviewer had a very negative experience with the hotel, citing issues with charges and poor management.",,SORRY_2026,negative,,,,,,,,,,,,
2b3e2390-4844-4241-a09b-4def2c78d588,"fantastic hotel happy stay, spent pre xmas family ...",5,positive,RECOMMENDATION,"The review highlights a fantastic stay at the hotel with excellent service, spacious rooms, and delicious meals, despite some minor drawbacks.",,,positive,Bilbao,Spain,RAG_Activity_Match,"Guggenheim Museum visit, Food tasting",Valencia,Spain,RAG_Activity_Match,"Paella workshop, City of Arts and Sciences visit",Bilbao,Spain,RAG_Activity_Match,"Guggenheim Museum visit, Pinxtos tour"
d75efa35-074b-489b-8835-8910f56a1d4e,"disappointing, arrived early evening lengthy trip ...",2,negative,DISCOUNT,"The review expresses disappointment with the small room, lack of air-conditioning, and issues with breakfast vouchers, leading to a negative overall experience.",uk,SORRY_2026,negative,,,,,,,,,,,,
014f5a9f-0852-48d6-8c31-fdde24876e05,fantastic service large hotel caters business corp...,5,positive,RECOMMENDATION,"The hotel provided fantastic service, a luxurious room with a great view, and thoughtful anniversary gifts, making it a highly recommended choice for a pampering stay.",,,positive,Monaco,Monaco,RAG_Activity_Match,"Casino visit, Yacht harbor tour",Valletta,Malta,RAG_Activity_Match,"Harbor cruise, Historical sites",Valletta,Malta,RAG_Activity_Match,"Harbor cruise, History museum visit"
cca3ea2d-e06b-4201-8d6d-8bc7eca0eddf,n't forget imodium just came 2 weeks bliss title s...,4,positive,RECOMMENDATION,"The review highlights a lovely holiday experience with clean pools, beautiful beach, and enjoyable food, despite some minor issues.",chicago,,positive,Budapest,Hungary,RAG_Activity_Match,"Thermal spa visit, Danube river cruise",Barcelona,Spain,RAG_Activity_Match,"City tour, Nightlife tour, Food tasting",Zurich,Switzerland,RAG_Activity_Match,"Lake Zurich cruise, Chocolate factory visit"
209e7992-7290-4270-a661-be412e990e1c,"n't, arrived hotel 11pm sat, night checked upgrade...",1,negative,DISCOUNT,"The hotel experience was marred by multiple issues including room conditions, water problems, and poor service.",access beach,SORRY_2026,negative,,,,,,,,,,,,
7b31a4e9-e86e-42a2-af13-093e5670148e,overpriced poor value money just returned long wee...,2,negative,DISCOUNT,"The hotel is overpriced with poor value for money, uncomfortable rooms, and noisy surroundings.",,SORRY_2026,negative,,,,,,,,,,,,
07ed1954-5af7-415f-81f0-dbbd6f24b2aa,robbed beds hotel security seriously lacking staye...,1,negative,DISCOUNT,"The hotel experience was marred by security issues, noise disturbances, and lack of natural light, leading to an overall unsatisfactory stay.",las ramblas,SORRY_2026,negative,,,,,,,,,,,,
54dccd40-5f35-4a25-9311-1d6b86ab7fb6,"low budget dump, place dump, stayed 2 nights june,...",1,negative,DISCOUNT,The hotel is described as a low-budget dump with multiple broken amenities and poor service.,,SORRY_2026,negative,,,,,,,,,,,,
8c1bf6b5-f637-4f42-a8bd-e6d42ec0034c,came nonexistent view loved really enjoyed stay no...,5,positive,RECOMMENDATION,"The hotel stay was enjoyable with a pleasant atmosphere, friendly staff, and a good location, despite some minor issues with the room view.","paris, luxembourg",,positive,Paris,France,NER_Location_Match,"Museum visit, Wine tasting",Lyon,France,RAG_Activity_Match,"Gastronomic tour, Historic center stroll",Toulouse,France,RAG_Activity_Match,"City tour, Food market visit"
728b5678-9e17-410f-8e6c-30cd0fc4be21,amazing personal service not tell impressed level ...,5,positive,RECOMMENDATION,"The review highlights exceptional personal service, impressive accommodations, and a great overall experience at the hotel.","dallas, chicago",,positive,Milan,Italy,RAG_Activity_Match,"Fashion district walk, Duomo rooftop tour",Dresden,Germany,RAG_Activity_Match,"Historic center walk, Art gallery visit",Warsaw,Poland,RAG_Activity_Match,"Old Town tour, Museum of Polish History"
d365d0ca-4766-40b0-9e20-153b79c4eaa7,room/casino not just relaxing short trip 4 nights ...,3,neutral,DISCOUNT,"The review highlights both positive aspects like the pool and beautiful views, as well as negative issues such as musty room smell and unhelpful casino staff.",punta cana,SORRY_2026,neutral,,,,,,,,,,,,
1d86acd2-9989-4f08-88c6-f7380a044f1a,"wonderful trip stayed hotel 5th 12th great time, c...",4,positive,RECOMMENDATION,"The hotel stay was enjoyable with excellent service, great food, and a beautiful location.",,,positive,Sharm El Sheikh,Egypt,RAG_Activity_Match,"Scuba diving, Bedouin dinner",Antalya,Turkey,RAG_Activity_Match,"Beach day, Boat tour",Sharm El Sheikh,Egypt,RAG_Activity_Match,"Snorkeling, Boat excursion"
255c1140-e585-4f4b-bdc2-6c3008467e5a,crappy overpriced place saving grace location amst...,2,negative,DISCOUNT,"The hotel is overpriced with poor service, worn furniture, and issues with room conditions, despite a good location.",amsterdam,SORRY_2026,negative,,,,,,,,,,,,
b922eb5c-c0ec-4ae9-bd12-ff13c64eb0e3,best price boston 3-star stayed friday june hotel ...,4,positive,RECOMMENDATION,"The hotel offers good prices, a convenient location, and clean accommodations, but the restaurant's breakfast buffet is disappointing.","inn, boston",,positive,Bodrum,Turkey,RAG_Activity_Match,"Beach club visit, Boat excursion",Brussels,Belgium,RAG_Activity_Match,"Chocolate tasting, Beer tour",Bilbao,Spain,RAG_Activity_Match,"Guggenheim Museum visit, Food tasting"
cce4ed03-350d-4d0e-b500-abae56e1ee12,"loved majestic hi returned majestic colonial 4,200...",3,neutral,DISCOUNT,"The review highlights both positive experiences and significant issues during the stay, leading to a neutral overall sentiment.",,SORRY_2026,neutral,,,,,,,,,,,,
9fb0f908-baca-44d6-9f8b-51574a2a748c,great hotel spent days melia hotel berlin fantasti...,5,positive,RECOMMENDATION,The review highlights a fantastic stay at a centrally located hotel with clean rooms and helpful staff.,berlin,,positive,Berlin,Germany,NER_Location_Match,"Museum Island visit, Nightlife tour",Berlin,Germany,NER_Location_Match,"Berlin Wall memorial, Street art tour",Frankfurt,Germany,RAG_Activity_Match,"Skyline tour, Museum Embankment visit"
3e1dd733-0490-4c0a-b334-0bf427c6cf25,"secrets excellence, sorry nothing excellent resort...",1,negative,DISCOUNT,"The reviewer had a disappointing experience at the resort, citing poor food, service, and overall quality compared to expectations.",,SORRY_2026,negative,,,,,,,,,,,,
ff5457b8-6fe7-432d-a55d-f35a58071784,hix great experience stayed loft 1 casa rodonda ea...,5,positive,RECOMMENDATION,"The review highlights a great experience at the hotel with beautiful views, a relaxing atmosphere, and enjoyable activities, despite a minor incident with stolen snorkel gear.","red beach, bay beach, vieques",,positive,Crete,Greece,RAG_Activity_Match,"Beach day, Local winery tour",Santorini,Greece,RAG_Activity_Match,"Wine tasting, Volcano excursion",Madeira,Portugal,RAG_Activity_Match,"Levadas hiking, Wine tasting"
a017d593-13dc-4787-b8d0-8337fa911507,not best night sleep stayed holiday inn beacon hil...,3,negative,DISCOUNT,"The hotel stay was disappointing due to noise issues, inadequate housekeeping, and an overpriced room.","boston, inn beacon",SORRY_2026,neutral,,,,,,,,,,,,
34d46f22-46db-4fe0-bef2-f08a16e7028c,best hotel service location date 25/11/2007i just ...,5,positive,RECOMMENDATION,"The reviewer had an enjoyable stay at the hotel, praising the excellent service and location.",belfast,,positive,Valletta,Malta,RAG_Activity_Match,"Harbor cruise, Historical sites",Valletta,Malta,RAG_Activity_Match,"Harbor cruise, History museum visit",Valletta,Malta,RAG_Activity_Match,"Harbor cruise, Nightlife tour"
9fa60f20-9a2e-4d30-9c25-ba7061cb17b6,"disaster area hotel doubt worst place stayed life,...",1,negative,DISCOUNT,"The hotel is described as a disaster area with tiny, dingy rooms and poor conditions, making it an unpleasant stay.",,SORRY_2026,negative,,,,,,,,,,,,
320eb38e-6ca9-4acf-9815-4f87480c7a5a,dial 911 read room room hot window cooler did n't ...,1,negative,DISCOUNT,"The review describes a series of serious issues with the hotel, including a lack of air conditioning, malfunctioning alarms, and uncomfortable accommodations, leading to a terrifying experience.",,SORRY_2026,negative,,,,,,,,,,,,
13941ef5-13e1-4500-a7c6-99a9bd39fe33,not family place family wanted spend couple days s...,2,negative,DISCOUNT,"The hotel was not suitable for families, had hidden costs, and did not provide good value for money.",seattle,SORRY_2026,negative,,,,,,,,,,,,
29de1236-af36-4e13-9b71-2b7404085748,"subtle changes reduced atmosphere, year family vac...",3,negative,DISCOUNT,"The review expresses disappointment over changes in the hotel's atmosphere and dining options, leading to a less enjoyable experience compared to previous visits.",,SORRY_2026,neutral,,,,,,,,,,,,
64da0162-7e73-41c5-a59e-eb26abe6fb5b,comfortable stay nice place stay wife daughter got...,4,positive,RECOMMENDATION,The hotel stay was comfortable with decent service and enjoyable amenities.,"beijing, china",,positive,Doha,Qatar,RAG_Activity_Match,"Souq Waqif visit, Museum of Islamic Art",Pamukkale,Turkey,RAG_Activity_Match,"Thermal pools, Ancient Hierapolis tour",Dresden,Germany,RAG_Activity_Match,"Art gallery tour, River Elbe walk"
3f3daef2-b039-4dba-88d1-68550b2dab7f,good value good rooms overpriced food just returne...,4,positive,RECOMMENDATION,"The hotel offers good value and clean rooms, but the food prices are considered overpriced.",moreat,,positive,Granada,Spain,RAG_Activity_Match,"Alhambra visit, Flamenco show",Malaga,Spain,RAG_Activity_Match,"Beach day, Picasso Museum visit",Seville,Spain,RAG_Activity_Match,"Cathedral tour, River cruise"
3715f72a-e08b-4c6d-aa23-083a402cb163,excellent resort great time intercontinental hotel...,5,positive,RECOMMENDATION,"The review highlights an excellent experience at the resort, particularly enjoying the pool, beach area, and dining at Ruth's Chris Steakhouse.",san juan,,positive,Monaco,Monaco,RAG_Activity_Match,"Casino visit, Yacht harbor tour",Seville,Spain,RAG_Activity_Match,"Cathedral tour, River cruise",Valletta,Malta,RAG_Activity_Match,"Harbor cruise, Nightlife tour"
47e6d8d9-74bd-412a-9147-ad0531ce24e9,paradise went hotel 2002 august 2003 book august 2...,5,positive,RECOMMENDATION,"The review mentions both positive aspects like the nice pool and rooms, and negative experiences with water-related issues.","portugal, japonese el romantico",,positive,Lisbon,Portugal,NER_Location_Match,"Fado music show, Wine tasting",Porto,Portugal,NER_Location_Match,"Wine tasting, River cruise",Coimbra,Portugal,NER_Location_Match,"University tour, Fado music show"
46a737f9-0544-41d4-a558-8f1b8feeea4e,fantastic hotel habita amazing hotel located cool ...,5,positive,RECOMMENDATION,"The hotel offers exceptional service, a beautiful atmosphere, and great value for money in a central location.","mexico city, mexico",,positive,Madrid,Spain,RAG_Activity_Match,"Prado Museum visit, Tapas crawl",Madrid,Spain,RAG_Activity_Match,"Cultural show (Flamenco), Food tasting",Barcelona,Spain,RAG_Activity_Match,"City tour, Nightlife tour, Food tasting"
df30491a-33c6-4b1e-b934-3383e7909299,"come n't understand bad reviews, hotel simple got ...",4,positive,RECOMMENDATION,"The hotel offers a comfortable bed, clean bathroom, and excellent price, conveniently located near Pike Place Market.",,,positive,Amman,Jordan,RAG_Activity_Match,"Citadel visit, Local market tour",Doha,Qatar,RAG_Activity_Match,"Souq Waqif visit, Museum of Islamic Art",Bilbao,Spain,RAG_Activity_Match,"Guggenheim Museum visit, Pinxtos tour"
c5ed16b3-ca89-4d48-a2bb-62366c5308ff,great location hard beds booked reading reviews tr...,3,neutral,DISCOUNT,"The hotel has a great location with helpful staff, but the beds are hard and the rooms are small and lack windows.","shenzhen, hong kong, tripadvisor, china",SORRY_2026,neutral,,,,,,,,,,,,
53d7fef4-368f-4c73-9147-a66c9db13de0,nice location friendly staff hotel active city cen...,4,positive,RECOMMENDATION,"The hotel offers a great location, friendly staff, and newly refurbished rooms, making it a convenient choice for exploring major attractions in Paris.",paris,,positive,Paris,France,NER_Location_Match,"Museum visit, Wine tasting",Nice,France,RAG_Activity_Match,"Beach day, Museum visit",Toulouse,France,RAG_Activity_Match,"City tour, Food market visit"
e88d8eb1-082d-4c6b-8811-b19b8f3e4171,disappointed say anticipating stay hotel monaco ba...,2,negative,DISCOUNT,"The review expresses disappointment with the hotel's service, decor, and overall experience despite some positive remarks about the housekeeping staff.","monaco, tripadvisor",SORRY_2026,negative,,,,,,,,,,,,
46462107-09d2-436b-b8e3-c18e3761b9ec,beautiful resort beautiful gardens friendly staff ...,3,positive,RECOMMENDATION,"The resort features beautiful gardens, friendly staff, and a nice beach, with no significant complaints.","south beach, miami",,neutral,Nice,France,RAG_Activity_Match,"Beach day, Old Town walk",Nice,France,RAG_Activity_Match,"Beach day, Museum visit",Bodrum,Turkey,RAG_Activity_Match,"Beach club visit, Boat excursion"
4b67410e-91d0-45f4-9b91-0b8547f94dec,"not problem, normally kind hotel 3 stars, hotels s...",4,positive,RECOMMENDATION,"The hotel offers a good location, friendly staff, and comfortable rooms at a reasonable price.",,,positive,Innsbruck,Austria,RAG_Activity_Match,"Cable car ride, Old Town visit",Limassol,Cyprus,RAG_Activity_Match,"Beach day, Castle visit",Frankfurt,Germany,RAG_Activity_Match,"Skyline tour, Museum Embankment visit"
1a6e9cd9-ab4e-4893-914a-5d2f1cb69f61,shang mid-life identity crisis absolutely agree pr...,2,negative,DISCOUNT,"The review expresses disappointment with the hotel's service, style, and overall experience, highlighting a mismatch between expectations and reality.","taipei, mo, sydney",SORRY_2026,negative,,,,,,,,,,,,
047d1f3b-5cb4-4ce4-8619-99eaed2f4aa1,not 5 star just got 7 jan 1 week vacation hotel 4 ...,3,negative,DISCOUNT,"The hotel experience was disappointing due to poor food quality, service issues, and unhelpful staff.",,SORRY_2026,neutral,,,,,,,,,,,,
79150229-8757-4baa-8da8-97ce82e13a22,great location hollow walls/floors location hotel ...,2,negative,DISCOUNT,The hotel has a perfect location but suffers from noise issues and basic room amenities.,bbc1,SORRY_2026,negative,,,,,,,,,,,,
099c87dc-29fe-4b43-9dbc-cb5c5aa21306,"globus tour stayed globus tour, tram/ bus/train/ s...",4,positive,RECOMMENDATION,The hotel is conveniently located near public transport and has helpful staff and clean rooms.,,,positive,Bucharest,Romania,RAG_Activity_Match,"Palace of Parliament tour, Historic center visit",Braga,Portugal,RAG_Activity_Match,"Historic churches tour, Local pastry tasting",Istanbul,Turkey,RAG_Activity_Match,"City tour, Boat ride on the Bosphorus"
b3bd1068-82e8-4fa4-8b02-64bf0a7e70f1,"gem, spent 2 nights hotel wife son usa holiday, kn...",4,positive,RECOMMENDATION,"The hotel offers great value with spacious rooms, friendly staff, and a convenient location, despite some minor issues with pillows and elevator access.","inn, hollywood, santa",,positive,Monaco,Monaco,RAG_Activity_Match,"Casino visit, Yacht harbor tour",Nice,France,RAG_Activity_Match,"Beach day, Museum visit",Seville,Spain,RAG_Activity_Match,"Cathedral visit, Cultural show (Flamenco)"
527e5672-3fe6-4f6a-af9f-ce1a4668cb34,hilton just fine scottish couple decided visit ber...,4,positive,RECOMMENDATION,"Despite an initial overbooking issue, the hotel's location, staff service, and breakfast options contributed to a positive experience.",berlin,,positive,Berlin,Germany,NER_Location_Match,"Museum Island visit, Nightlife tour",Berlin,Germany,NER_Location_Match,"Berlin Wall memorial, Street art tour",Budapest,Hungary,RAG_Activity_Match,"Thermal bath visit, Nightlife tour"
e6e11fc7-1e5c-4bb8-8387-f4c8773c10fd,second visit ubud village resort stayed ubud villa...,5,positive,RECOMMENDATION,"The review highlights a wonderful experience at Ubud Village Resort, emphasizing its luxurious amenities and excellent service, making it a preferred choice for future visits.",,,positive,Budapest,Hungary,RAG_Activity_Match,"Thermal bath visit, Nightlife tour",Sofia,Bulgaria,RAG_Activity_Match,"Rila Monastery day trip, Food tasting",Zurich,Switzerland,RAG_Activity_Match,"Lake cruise, Museum visit"
54d938da-735c-4be2-b028-c9751aec4711,"stay clear, couples went amsterdam weekend trip 20...",1,negative,DISCOUNT,"The hotel experience was marred by extreme heat, a theft incident, and poor response from the staff, despite some positive aspects like cleanliness and location.",amsterdam,SORRY_2026,negative,,,,,,,,,,,,
7f720357-961c-4028-8e36-9c6aee668ce0,brilliant beautiful friendly not understand compla...,4,positive,RECOMMENDATION,"The hotel is described as beautiful and friendly, with a magnificent setting and helpful staff, making it a great choice for special occasions.",,,positive,Muscat,Oman,RAG_Activity_Match,"Sultan Qaboos Grand Mosque visit, Beach day",Bodrum,Turkey,RAG_Activity_Match,"Beach club visit, Boat excursion",Varna,Bulgaria,RAG_Activity_Match,"Beach day, Nightlife tour"
11ffabba-371e-47c9-97c6-084044319e4a,subterranean inn par view yes view posted reviews ...,2,negative,DISCOUNT,"The review highlights both positive aspects, such as the stunning views and accommodating staff, and negative aspects, including odor issues and lack of air conditioning.",,SORRY_2026,negative,,,,,,,,,,,,
2f73205d-0119-4e1d-9750-c1e16ff894e1,"loved, stayed sofitel june 2004 9 nights, fantasti...",5,positive,RECOMMENDATION,"The reviewer had a fantastic stay at Sofitel, praising the location, luxurious room, and helpful staff.",ny,,positive,Paris,France,RAG_Activity_Match,"Museum visit, Wine tasting",Monaco,Monaco,RAG_Activity_Match,"Casino visit, Yacht harbor tour",Sharm El Sheikh,Egypt,RAG_Activity_Match,"Scuba diving, Bedouin dinner"
e3abf019-945d-4a11-8f41-967440cbcff8,"overpriced stayed dump coming online, look beautif...",1,negative,DISCOUNT,"The hotel was overpriced and disappointing, with uncomfortable beds, poor cleanliness, and inadequate amenities.",,SORRY_2026,negative,,,,,,,,,,,,
a8d7faff-c7eb-42ae-a99d-cdcb37308d98,"great location stayed hotel luxer night, great loc...",3,positive,RECOMMENDATION,"The hotel has a great location, clean rooms, and comfortable facilities, making it a recommended choice for travelers.",canada,,neutral,Zurich,Switzerland,RAG_Activity_Match,"Lake cruise, Museum visit",Bruges,Belgium,RAG_Activity_Match,"Canal cruise, Brewery visit",Zurich,Switzerland,RAG_Activity_Match,"Lake Zurich cruise, Chocolate factory visit"
8e73d636-a679-4d1a-b22b-7c8c2f2f8fb9,hotel krasnapolsky just returned stay hotel krasna...,2,negative,DISCOUNT,"The review expresses mixed feelings about the stay at Hotel Krasnapolsky, highlighting both positive aspects like location and breakfast, and negative points such as room quality and unpleasant smells.",amsterdam,SORRY_2026,negative,,,,,,,,,,,,
ba54ff16-dc65-48e5-95e4-7d393d14c2e8,sleek modern hotel outside central boston we__Ç_é...,5,positive,RECOMMENDATION,"The hotel offers a sleek, modern experience with clean rooms, comfortable beds, and helpful staff, making it a great choice despite its location outside central Boston.",boston,,positive,Brussels,Belgium,RAG_Activity_Match,"Chocolate tasting, Beer tour",Mykonos,Greece,RAG_Activity_Match,"Beach party, Boutique shopping",Bruges,Belgium,RAG_Activity_Match,"Canal cruise, Brewery visit"
b70b5dec-e861-48f4-802f-6ccc5e5b3b76,good location value everybody agrees location not ...,4,positive,RECOMMENDATION,"The hotel offers a great location, helpful staff, and comfortable accommodations, providing overall good value.",,,positive,Dresden,Germany,RAG_Activity_Match,"Historic center walk, Art gallery visit",Bucharest,Romania,RAG_Activity_Match,"Palace of Parliament tour, Historic center visit",Bucharest,Romania,RAG_Activity_Match,"Palace of Parliament tour, Old Town pub crawl"
a0004dba-bda1-4fd1-b421-58be230c3116,nightmare start dates family went feb11-18 huge pr...,2,negative,DISCOUNT,"The review describes a disappointing experience with mosquito infestations, inadequate room maintenance, and unsatisfactory food options, despite some positive notes about staff friendliness and entertainment.",,SORRY_2026,negative,,,,,,,,,,,,
1e7693cc-291b-46c3-b618-0fa2a3cef840,sorry outdated boring moment walked lobby thought ...,1,negative,DISCOUNT,"The hotel is outdated and does not match its marketing, with poor customer service.",spain,SORRY_2026,negative,,,,,,,,,,,,
