review_id,review_snippet,score,pred_sentiment,action,summary,ner_locations,Discount_Code,true_sentiment,Rec_1_City,Rec_1_Country,Rec_1_Reason,Rec_1_Activities,Rec_2_City,Rec_2_Country,Rec_2_Reason,Rec_2_Activities,Rec_3_City,Rec_3_Country,Rec_3_Reason,Rec_3_Activities
9ef7762f-dfbc-45e8-ad2b-5a62a8b11522,nice clean hotel booked hotel getaway city-trip wi...,3,positive,RECOMMENDATION,"The hotel is clean, modern, and well-located, offering good value for money.",,,neutral,Barcelona,Spain,RAG_Activity_Match,"City tour, Nightlife tour, Food tasting",Valencia,Spain,RAG_Activity_Match,"City of Arts and Sciences visit, Beach day",Valencia,Spain,RAG_Activity_Match,"Paella workshop, City of Arts and Sciences visit"
7d47d100-159e-4a55-9396-645ad4e0490b,good hotel good location just returned weekend le ...,5,positive,RECOMMENDATION,"The hotel offers a good location and friendly service, making for a nice stay despite minor decor issues.",,,positive,Malaga,Spain,RAG_Activity_Match,"Beach day, Picasso Museum visit",Dresden,Germany,RAG_Activity_Match,"Art gallery tour, River Elbe walk",Nice,France,RAG_Activity_Match,"Beach day, Museum visit"
fc63b8e4-66ec-4270-b6d0-5d2b09317bea,holiday inn express better holiday inn hit gym wor...,1,negative,DISCOUNT,"The hotel experience was disappointing with dirty rooms, outdated gym equipment, and a misleadingly attractive lobby.","inn, wyndham, inn logo.the",SORRY_2026,negative,,,,,,,,,,,,
cfaf46c4-4a16-45a6-b4ad-1ca85cd8838b,"basic tourist hotel clean plain quite adequate, ro...",3,positive,RECOMMENDATION,"The hotel is a clean and adequate option for tourists, conveniently located near shopping and transportation.",tokyo,,neutral,Frankfurt,Germany,RAG_Activity_Match,"Skyline tour, Museum Embankment visit",Berlin,Germany,RAG_Activity_Match,"Museum Island visit, Nightlife tour",Jerusalem,Israel,RAG_Activity_Match,"Religious sites tour, Local market visit"
2e8d079e-f8ed-4280-9977-8c2ddc64cdbe,cozy caring treat enter cozy small inn treated exc...,5,positive,RECOMMENDATION,"The cozy inn offers exceptional customer service, delicious food, and a welcoming atmosphere, making it a great place to relax.",,,positive,Innsbruck,Austria,RAG_Activity_Match,"Cable car ride, Old Town visit",Bilbao,Spain,RAG_Activity_Match,"Guggenheim Museum visit, Food tasting",Milan,Italy,RAG_Activity_Match,"Fashion district walk, Duomo rooftop tour"
93bd17cd-203d-4632-8b4e-087132e7e1c9,"great stay renaissance, definetly nicer cleaner ha...",5,positive,RECOMMENDATION,"The review highlights a great stay at the Renaissance hotel, praising its location, cleanliness, and friendly staff, despite some concerns about the surrounding area at night.","san fransisco, l.a, santa monica beach, hollywood, l.a., california, beverley hills, hollywood highland",,positive,Nice,France,RAG_Activity_Match,"Beach day, Museum visit",Rhodes,Greece,RAG_Activity_Match,"Medieval city tour, Beach day",Monaco,Monaco,RAG_Activity_Match,"Casino visit, Yacht harbor tour"
c833b34d-271a-4a3f-b792-6a6e1a97184a,place consider booked hotel superior ratings recei...,3,neutral,DISCOUNT,"The hotel met basic needs with helpful staff, but had several drawbacks such as a small pool, old television, and lack of individual room temperature control.",,SORRY_2026,neutral,,,,,,,,,,,,
162010d3-3dae-4f25-a3f7-ac2bb08d371d,great service ok overall stayed night hilton.it gr...,3,neutral,DISCOUNT,"The hotel offers great service and convenient amenities, but the breakfast experience was disappointing.","keio, shinjuku, tokyo",SORRY_2026,neutral,,,,,,,,,,,,
d9d785a9-68c8-4e01-aaf7-b04f1fc770c6,kacho sushi restaurant waikiki parc introduced wai...,1,negative,DISCOUNT,"The review expresses frustration over being turned away from the sushi restaurant due to dress code enforcement, despite prior expectations based on the website's information.","roys, waikiki beach, honolulu",SORRY_2026,negative,,,,,,,,,,,,
a7990720-9f57-4588-9735-dc324d0cb41d,great time isolated complex stayed week july 23 ju...,4,positive,RECOMMENDATION,"The review reflects a mix of experiences, highlighting both positive aspects like the beautiful beach and negative points such as grumpy staff and high souvenir prices.",domincan republic,,positive,Malaga,Spain,RAG_Activity_Match,"Beach day, Picasso Museum visit",Rhodes,Greece,RAG_Activity_Match,"Medieval city tour, Beach day",Varna,Bulgaria,RAG_Activity_Match,"Beach day, Archaeological museum visit"
1d84c29c-8a41-4638-874f-1c4a629932a1,worst starwood experience worst starwood hotel sta...,1,negative,DISCOUNT,The review expresses dissatisfaction with the poor customer service and overall experience at the hotel.,,SORRY_2026,negative,,,,,,,,,,,,
6f44a891-1395-43a9-b1ee-bf9fd78accf0,modern great price price comfort location ca n't b...,4,positive,RECOMMENDATION,"The hotel offers modern comfort at a great price, but the street noise can be bothersome.",,,positive,Milan,Italy,RAG_Activity_Match,"Fashion district walk, Duomo rooftop tour",Monaco,Monaco,RAG_Activity_Match,"Casino visit, Yacht harbor tour",Nicosia,Cyprus,RAG_Activity_Match,"Historical sites, Local market visit"
f8e38b4e-5a0d-4fd4-9d5e-5c8d5ffdf76b,excellent hotel near airport good value money exce...,4,positive,RECOMMENDATION,"The hotel offers good value with spacious rooms and convenient airport access, but has issues with shower facilities and limited dining options.","japan, buddha po lin, hong kong",,positive,Budapest,Hungary,RAG_Activity_Match,"Thermal bath visit, Nightlife tour",Valletta,Malta,RAG_Activity_Match,"Harbor cruise, Historical sites",Budapest,Hungary,RAG_Activity_Match,"Thermal bath visit, Ruin bar tour"
2df77eb6-ff39-46af-aaa4-5618d0e49099,disappointed having seen excellent reviews trip ad...,1,negative,DISCOUNT,"The reviewer was disappointed with their stay due to unfriendly staff and a shabby room, which did not meet their expectations.",,SORRY_2026,negative,,,,,,,,,,,,
951d1731-cef3-431c-bfd9-eb1880cd6f5a,great location limitations arrived midweek wait de...,3,neutral,DISCOUNT,The hotel has a great location but several issues with amenities and service detract from the overall experience.,palmas del mar,SORRY_2026,neutral,,,,,,,,,,,,
b89cd4c8-a766-4d29-a8fa-441e7b52f9f5,stylish superb decision stay half week long break ...,5,positive,RECOMMENDATION,The hotel offers a stylish and hospitable experience with excellent amenities and a great location for sightseeing.,berlin,,positive,Berlin,Germany,NER_Location_Match,"Museum Island visit, Nightlife tour",Berlin,Germany,NER_Location_Match,"Berlin Wall memorial, Street art tour",Frankfurt,Germany,RAG_Activity_Match,"Skyline tour, Museum Embankment visit"
91228372-8038-46ba-b3df-6319a1b18595,tired worn stayed kensington park hotel 19/01/08 4...,2,negative,DISCOUNT,"The hotel was tired and worn, with issues such as a dirty carpet, ineffective heating, and noisy housekeeping, making the stay disappointing.","san fransisco, fishermans wharf",SORRY_2026,negative,,,,,,,,,,,,
02fd7c57-3b36-4e9e-9c22-ba26a98f7b16,"avoid stayed hotel way europe japan, booked 3 nigh...",1,negative,DISCOUNT,"The hotel experience was disappointing due to cleanliness issues and poor service, despite a good location.",singapore,SORRY_2026,negative,,,,,,,,,,,,
a006838a-bd32-4931-aeea-ab785c8265ad,"best option airport, confortable nicely decorated ...",4,positive,RECOMMENDATION,"The hotel offers a great airport location with comfortable, nicely decorated rooms and good service.",,,positive,Innsbruck,Austria,RAG_Activity_Match,"Cable car ride, Old Town visit",Abu Dhabi,United Arab Emirates,RAG_Activity_Match,"Desert safari, Grand Mosque visit",Doha,Qatar,RAG_Activity_Match,"Souq Waqif visit, Museum of Islamic Art"
4dd41cdc-a251-4977-8daa-01f303811ab2,"large personalized service, terrible food terrible...",1,negative,DISCOUNT,"The review highlights significant issues with food quality and service, overshadowing the positive aspects of the hotel's amenities and location.",,SORRY_2026,negative,,,,,,,,,,,,
bb7e191c-129c-43c7-b757-f81405bdb9a8,cesspool carribean booked trip apple vacations n't...,1,negative,DISCOUNT,"The review expresses significant dissatisfaction with the resort's service, food quality, and booking issues, despite mentioning a beautiful beach.",,SORRY_2026,negative,,,,,,,,,,,,
8a39a7e6-6487-4f2c-8ea1-7307e43029d3,"great location horrible hotel, aaah new orleans gr...",1,negative,DISCOUNT,"The hotel has a great location but suffers from poor service, cleanliness issues, and maintenance problems.","inn, new orleans",SORRY_2026,negative,,,,,,,,,,,,
f493c9fd-d451-4a82-aaa1-1c5c41f4bcdb,hostel steroids definite potential location great ...,2,negative,DISCOUNT,"The hotel has potential due to its location and decor, but the cleanliness and comfort of the rooms are severely lacking, making it unsuitable for a pleasant stay.",,SORRY_2026,negative,,,,,,,,,,,,
811518a2-5146-4afe-8c63-e7cfb5d91827,nice place no sleep.. writing second night terribl...,3,negative,DISCOUNT,"The hotel has nice amenities and staff, but the uncomfortable bed and poor sleep quality overshadow the positives.",,SORRY_2026,neutral,,,,,,,,,,,,
2541bc8a-0a28-47aa-8f66-faf95f199e27,comfortable stay isolated problem min-bar charge h...,3,neutral,DISCOUNT,"The hotel offers a comfortable stay with good amenities, but there are issues with isolation, dining costs, and erroneous charges.",dallas,SORRY_2026,neutral,,,,,,,,,,,,
c95d9e4a-e3d8-4955-9360-4631229c7d1e,fantastic experience stayed convention extremely n...,4,positive,RECOMMENDATION,"The hotel stay was fantastic with friendly staff, comfortable beds, and a great location near Times Square.",manhattan,,positive,Bucharest,Romania,RAG_Activity_Match,"Palace of Parliament tour, Historic center visit",Budapest,Hungary,RAG_Activity_Match,"Thermal bath visit, Nightlife tour",Budapest,Hungary,RAG_Activity_Match,"Thermal bath visit, Ruin bar tour"
b8bd669b-5ecf-4880-83d7-d59471bb4df5,great location reasonable hotel overall happy stay...,4,positive,RECOMMENDATION,"The hotel had a great location and comfortable rooms, but there were significant issues with check-in and room arrangements.","agreed.-, singapore, padang city, sydney, london",,positive,Valletta,Malta,RAG_Activity_Match,"Harbor cruise, Nightlife tour",Basel,Switzerland,RAG_Activity_Match,"Museum visit, Rhine River walk",Frankfurt,Germany,RAG_Activity_Match,"Skyline tour, Museum Embankment visit"
0ae509ac-3f14-434b-b784-d8f084159927,overpriced tiny dirty room suite smaller normal ho...,1,negative,DISCOUNT,"The review describes a disappointing experience with an overpriced, dirty room, rude staff, and poor service throughout the stay.",,SORRY_2026,negative,,,,,,,,,,,,
7c87363c-4a95-4c05-a8da-c688d13c476f,"superb, fifth time stayed hotel years, having amst...",5,positive,RECOMMENDATION,"The hotel offers a superb experience with great location, good service, and excellent rooms, making it worth the slightly higher price.",,,positive,Amsterdam,Netherlands,RAG_Activity_Match,"Canal cruise, Museum visit",Amsterdam,Netherlands,RAG_Activity_Match,"Cycling tour, Van Gogh Museum visit",Bruges,Belgium,RAG_Activity_Match,"Canal cruise, Brewery visit"
142130b0-9f14-4499-946f-a2eb42c2b863,"nice vacation traveler beware, wife just returned ...",2,negative,DISCOUNT,"The review highlights several significant issues with the resort, including poor service, food poisoning, and communication difficulties, overshadowing the positive aspects of the vacation.",punta cana,SORRY_2026,negative,,,,,,,,,,,,
9ccc28b9-1de6-4ef8-a3a4-cb76d677b403,"trade-off el san juan treasure mixed bag say, noth...",3,negative,DISCOUNT,The hotel experience was disappointing due to poor room conditions and inadequate refurbishment despite some positive dining options.,"wyndham, jan., san juan",SORRY_2026,neutral,,,,,,,,,,,,
392033ef-ff19-47bf-be62-0a6c357b3e2d,"trip hell thoughts gotten, trip airport van no air...",1,negative,DISCOUNT,"The review describes a series of frustrating experiences during the trip, including poor service, unclean rooms, and overall dissatisfaction with the hotel amenities.",,SORRY_2026,negative,,,,,,,,,,,,
0241f4a5-6098-489c-975a-7dffb8951d8c,tiny rooms near eiffel tower affordable hotel near...,2,negative,DISCOUNT,"The hotel has tiny, charmless rooms that are difficult to manage, despite its affordable location near the Eiffel Tower.",,SORRY_2026,negative,,,,,,,,,,,,
b827ee36-49a9-45b0-a017-a52cc6498d88,"no riu bambu 11 just got 4 day stretch place, say ...",2,negative,DISCOUNT,"The review expresses dissatisfaction with the service, room quality, food, and health issues experienced during the stay.",diarohia,SORRY_2026,negative,,,,,,,,,,,,
68f5e0d6-62bc-427e-8f11-5e6ac77b6dd8,"mmmmmm staff great bonus travelling 3 year old, ro...",3,neutral,DISCOUNT,"The staff was great, but the rooms were old-fashioned and the hotel is not centrally located.",,SORRY_2026,neutral,,,,,,,,,,,,
0288638e-17ce-4f0c-bd4f-c707418f30e4,"wouldnt, family just returned 5 night stay maile s...",2,negative,DISCOUNT,"The hotel stay was uncomfortable with poor room conditions and unhelpful staff, leading to a decision not to return.",,SORRY_2026,negative,,,,,,,,,,,,
a0e8d17c-c01a-4f4d-9fa2-921037a9a344,nice overpriced crowded location great right stree...,3,negative,DISCOUNT,The hotel is in a great location but is overpriced and lacks good service and amenities.,hyatt,SORRY_2026,neutral,,,,,,,,,,,,
c2f580d9-5d14-4f83-90e5-8c749f99a34b,"complaining, just got breezes say barcelo premium ...",4,positive,RECOMMENDATION,"The reviewer had a great time at the hotel, enjoyed the food and service, and highly recommends it despite some minor issues.","barcelo premium, manati park",,positive,Barcelona,Spain,RAG_Activity_Match,"City tour, Nightlife tour, Food tasting",Monaco,Monaco,RAG_Activity_Match,"Casino visit, Yacht harbor tour",Malaga,Spain,RAG_Activity_Match,"Beach day, Tapas tour"
fa9b66ac-e1ec-42e8-9669-392636b8ac36,probably value money hotel stayed stayed 3 years a...,5,positive,RECOMMENDATION,"The hotel offers great value for money with a fantastic location, clean and cozy rooms, and friendly staff.",san fransisco,,positive,Nice,France,RAG_Activity_Match,"Beach day, Old Town walk",Bilbao,Spain,RAG_Activity_Match,"Guggenheim Museum visit, Food tasting",Bilbao,Spain,RAG_Activity_Match,"Guggenheim Museum visit, Pinxtos tour"
14a8828a-c37c-42ff-ad23-8a591bef8a55,horrible layne hotel lured hotel phone incredibly ...,1,negative,DISCOUNT,"The review expresses dissatisfaction with the hotel's pricing, misleading information, and safety concerns in the neighborhood.",,SORRY_2026,negative,,,,,,,,,,,,
cdccb78a-84c1-4ca0-ab41-dc260e8eb245,"outdated run, business traveler high expectations,...",1,negative,DISCOUNT,"The hotel experience was disappointing due to outdated facilities, poor service, and unmet expectations for a Wyndham property.","wyndham, miami beach",SORRY_2026,negative,,,,,,,,,,,,
9cbb16e1-02bf-438d-ab69-ad0e33feacf9,lack customer service skills overpriced place onli...,2,negative,DISCOUNT,"The review highlights poor customer service, unexpected charges, and unsatisfactory cleanliness, leading to a disappointing experience.",,SORRY_2026,negative,,,,,,,,,,,,
6560da4f-a990-402d-a790-034b8b0e09c6,star ghetto motel hi arrived ant recomended supose...,2,negative,DISCOUNT,"The hotel experience was disappointing due to rude staff, poor room conditions, and overall lack of cleanliness and comfort.",,SORRY_2026,negative,,,,,,,,,,,,
70a71fb4-0a9d-4fbb-9631-0438d90d957d,"number hotel number ranking, perfect way, best bre...",5,positive,RECOMMENDATION,The hotel is highly rated with an excellent breakfast.,,,positive,Vienna,Austria,RAG_Activity_Match,"Opera visit, Schnitzel tasting",Brussels,Belgium,RAG_Activity_Match,"Chocolate tasting, Beer tour",Bucharest,Romania,RAG_Activity_Match,"Palace of Parliament tour, Historic center visit"
82c1d17f-7362-40a2-9116-2e540cda56f7,great pool best restaurants chez isabelle agave sp...,4,positive,RECOMMENDATION,"The hotel features a great pool, nice rooms, fun entertainment, and offers excellent excursions.","4wheeling macao beach, saona island",,positive,Agadir,Morocco,RAG_Activity_Match,"Beach day, Surf lesson",Monaco,Monaco,RAG_Activity_Match,"Casino visit, Yacht harbor tour",Nice,France,RAG_Activity_Match,"Beach day, Museum visit"
35449e02-ced0-4f59-9a87-656927effdbe,does not live hype wanted love peninsula beijing d...,2,negative,DISCOUNT,"The hotel experience was disappointing due to small rooms, poor cleanliness, and a problematic tour arrangement, despite some positive aspects like location and concierge service.","beijing, china",SORRY_2026,negative,,,,,,,,,,,,
851ef961-f424-4f23-a041-d14711d23011,"excellent hotel, time barcelona celebrate wifes bi...",5,positive,RECOMMENDATION,"The hotel exceeded expectations with excellent service, modern rooms, and a comfortable atmosphere, making it a great choice for celebrating special occasions.",barcelona,,positive,Barcelona,Spain,NER_Location_Match,"City tour, Nightlife tour, Food tasting",Bilbao,Spain,RAG_Activity_Match,"Guggenheim Museum visit, Food tasting",Madrid,Spain,RAG_Activity_Match,"Prado Museum visit, Tapas crawl"
4fdc00e0-af41-48ba-a003-57bc1fcd898e,"honeymoon hell begin, arrived hotel staff did n't ...",1,negative,DISCOUNT,"The review describes a disastrous honeymoon experience with numerous issues including poor service, inadequate room conditions, and food poisoning.",jamaica,SORRY_2026,negative,,,,,,,,,,,,
d21ffc2e-4da7-47aa-baa2-2cc0c262ff9b,disappointed 1 gold passport profile clearly state...,2,negative,DISCOUNT,"The review expresses disappointment with multiple issues during the hotel stay, including room preferences not being met, maintenance problems, and overall dissatisfaction.",,SORRY_2026,negative,,,,,,,,,,,,
dd9c508f-3f80-4997-a185-5c9dd94dfc13,"expect happy desk people satisfied room, coming la...",2,negative,DISCOUNT,"The review highlights several issues with the hotel, including an intimidating location, a tiny and poorly maintained bathroom, and inappropriate television content.",amsterdam,SORRY_2026,negative,,,,,,,,,,,,
0f771610-4fa3-4229-a4ef-3331e8331c7e,"experience visited red lion 5th avenue night stay,...",2,negative,DISCOUNT,"The hotel has a great location, but the high price, poor customer service, and noise issues made for a disappointing stay.",,SORRY_2026,negative,,,,,,,,,,,,
296f0b31-0830-4cbc-b7a4-12936fef91ff,elegant hotel stayed bedroom apartment adjoining h...,4,positive,RECOMMENDATION,"The hotel offers an elegant atmosphere and good service, but there were issues with the mini bar and some amenities.",,,positive,Florence,Italy,RAG_Activity_Match,"Art gallery tour, Cooking class",Florence,Italy,RAG_Activity_Match,"Uffizi Gallery visit, Gelato tasting",Milan,Italy,RAG_Activity_Match,"Fashion district walk, Duomo rooftop tour"
d24e1137-b4a1-43da-9829-a7c8c8fa340e,"not recommend just returned week paradisus, absolu...",2,negative,DISCOUNT,The review expresses disappointment with the service and food quality at the hotel despite its beautiful setting.,,SORRY_2026,negative,,,,,,,,,,,,
7f61a7bb-053a-418a-9c89-574ad8713833,good choice tokyo spent nights park hotel girlfrie...,4,positive,RECOMMENDATION,"The hotel is a good choice in Tokyo, offering a modern and clean environment with friendly staff and convenient location.",tokyo,,positive,Milan,Italy,RAG_Activity_Match,"Fashion district walk, Duomo rooftop tour",Nicosia,Cyprus,RAG_Activity_Match,"Cultural tour, Local tavern night",Bilbao,Spain,RAG_Activity_Match,"Guggenheim Museum visit, Pinxtos tour"
2e368781-847b-40f7-9ef6-df099b8e116d,beautiful resort n't return boyfriend visited bahi...,3,neutral,DISCOUNT,The review describes a beautiful resort with good service and facilities but expresses disappointment with the food quality and mentions issues with bugs and sickness.,"cana, punta cana",SORRY_2026,neutral,,,,,,,,,,,,
2b518a8b-389e-4880-8ba7-4a5ca9f6b256,crap breakfast looked reviews couple hotels amster...,1,negative,DISCOUNT,"The hotel had a terrible breakfast, bed bugs, and issues with cleanliness, despite a good location.","manofa damrak, amsterdam",SORRY_2026,negative,,,,,,,,,,,,
6089effd-6975-4fc7-96f4-f945f3615855,ok not general hotel ok price not bad rooms not re...,3,neutral,DISCOUNT,"The hotel has a good location and clean bathrooms, but the service and breakfast communication were confusing and average.",,SORRY_2026,neutral,,,,,,,,,,,,
de6c27c6-5ca5-4889-938d-89d7f9c2f62e,"bedbugs just returned trip beijing, unfamiliar cit...",1,negative,DISCOUNT,"The review describes a very poor experience at the hotel, highlighting issues with cleanliness, service, and bedbugs.",beijing,SORRY_2026,negative,,,,,,,,,,,,
78427d5b-1de4-49c4-aae2-56588fa54072,place great food not overall place good room good ...,3,neutral,DISCOUNT,The review mentions good food and friendly staff but also highlights issues with reception staff and dinner booking.,,SORRY_2026,neutral,,,,,,,,,,,,
0ea2e992-a9c6-4919-88e7-976f25123456,barcelo bavraro casino hotel just returned punta c...,2,negative,DISCOUNT,"The review highlights numerous issues with the hotel, including rude staff, dated rooms, and a lack of warmth, overshadowing the beautiful setting and beach.",punta cana,SORRY_2026,negative,,,,,,,,,,,,
6729f28a-bcda-4bd7-aa3d-7c221912015f,parts stayed twice agree positive points location ...,4,positive,RECOMMENDATION,"The review highlights both positive aspects like location and food quality, and negative experiences with service and room availability, leading to a neutral overall sentiment.","london, california",,positive,Vienna,Austria,RAG_Activity_Match,"Classical concert, Museum visit",Bilbao,Spain,RAG_Activity_Match,"Guggenheim Museum visit, Food tasting",Frankfurt,Germany,RAG_Activity_Match,"Skyline tour, Museum Embankment visit"
d267474c-d66e-4e57-a373-f0e4e61cabaf,"excellent pre cruise stop, absolutely faultless, s...",5,positive,RECOMMENDATION,"The hotel is an excellent pre-cruise stop with clean, well-furnished rooms and helpful staff, despite some concerns about breakfast pricing and luggage transport.",,,positive,Valletta,Malta,RAG_Activity_Match,"Harbor cruise, Historical sites",Barcelona,Spain,RAG_Activity_Match,"City tour, Nightlife tour, Food tasting",Monaco,Monaco,RAG_Activity_Match,"Casino visit, Yacht harbor tour"
7caa73f1-a9a8-48e9-b441-585df7fb7810,"thank goodness free, ok let start saying husband c...",2,negative,DISCOUNT,"The review highlights significant issues with food quality, room cleanliness, and overall discomfort, despite some positive aspects like the pool and friendly staff.",,SORRY_2026,negative,,,,,,,,,,,,
feacdafb-6e56-40a5-b306-da14e4e4b7be,bad hotel really awful place dirty room rude staff...,1,negative,DISCOUNT,The hotel is described as dirty with rude staff and a bad breakfast.,,SORRY_2026,negative,,,,,,,,,,,,
83d04f0d-5574-42e2-8557-7d26ae7b73d1,royal service melia just want add going royal serv...,3,positive,RECOMMENDATION,"The review highlights the exceptional service and amenities of the Royal Service at Melia, emphasizing the benefits of private pools, better dining options, and a more comfortable check-in experience.",,,neutral,Monaco,Monaco,RAG_Activity_Match,"Casino visit, Yacht harbor tour",Valletta,Malta,RAG_Activity_Match,"Harbor cruise, Nightlife tour",Valletta,Malta,RAG_Activity_Match,"Harbor cruise, Historical sites"
73dc877a-1cc6-47ac-ad71-290841304f79,"sirenis cocotal beach resort wonderful, sirenis co...",4,positive,RECOMMENDATION,"The review highlights a wonderful experience at Sirenis Cocotal Beach Resort, praising the helpful staff, beautiful accommodations, and enjoyable amenities.","punta cana, u.s., u.k., pool beach, orlando",,positive,Barcelona,Spain,RAG_Activity_Match,"City tour, Nightlife tour, Food tasting",Malaga,Spain,RAG_Activity_Match,"Beach day, Picasso Museum visit",Malaga,Spain,RAG_Activity_Match,"Beach day, Tapas tour"
a9876d94-5d6d-4fc1-80d7-02a59434cf25,"modern clean cool stay, really nice located modern...",4,positive,RECOMMENDATION,"The hotel is modern, clean, well-located, and offers good facilities, making it a great value for various types of travelers.",barcelona,,positive,Barcelona,Spain,NER_Location_Match,"City tour, Nightlife tour, Food tasting",Valencia,Spain,RAG_Activity_Match,"City of Arts and Sciences visit, Beach day",Bilbao,Spain,RAG_Activity_Match,"Guggenheim Museum visit, Food tasting"
4998f4a7-0873-47cb-b1db-75f0edc1dc38,great hotel central location stayed barbizon pasla...,5,positive,RECOMMENDATION,"The hotel offers a great central location, spacious rooms, helpful staff, and delicious dining options, making for a wonderful stay.",,,positive,Budapest,Hungary,RAG_Activity_Match,"Thermal bath visit, Ruin bar tour",Budapest,Hungary,RAG_Activity_Match,"Thermal bath visit, Nightlife tour",Budapest,Hungary,RAG_Activity_Match,"Thermal spa visit, Danube river cruise"
fc382184-2ace-41cb-b16f-17a3405ac09d,best ok restaurant food good housekeeping staff fr...,2,negative,DISCOUNT,"The review expresses disappointment with service quality and unexpected charges, despite some positive aspects like friendly staff and comfortable accommodations.",,SORRY_2026,negative,,,,,,,,,,,,
90a9a75e-5aed-482b-9fff-f0fc5322093d,great location value cautious staying hotel locati...,5,positive,RECOMMENDATION,"The hotel offers a great location, modern amenities, and excellent service, making it a favorable choice for travelers.",beijing,,positive,Bucharest,Romania,RAG_Activity_Match,"Palace of Parliament tour, Historic center visit",Bucharest,Romania,RAG_Activity_Match,"Palace of Parliament tour, Old Town pub crawl",Budapest,Hungary,RAG_Activity_Match,"Thermal bath visit, Nightlife tour"
