review_id,review_snippet,score,pred_sentiment,action,summary,ner_locations,Discount_Code,true_sentiment,Rec_1_City,Rec_1_Country,Rec_1_Reason,Rec_1_Activities,Rec_2_City,Rec_2_Country,Rec_2_Reason,Rec_2_Activities,Rec_3_City,Rec_3_Country,Rec_3_Reason,Rec_3_Activities
bfc7004c-0a8a-4a91-a69f-139f59fef96a,medium yes place mixed reviews depending reviewer ...,2,negative,DISCOUNT,"The hotel has significant issues with staff knowledge, housekeeping, and plumbing, overshadowing its character and discounted price.",,SORRY_2026,negative,,,,,,,,,,,,
87c58761-8558-40ff-bf20-0e074ed86bf8,"ritz tip trip ritz-carlton battery park, like tip ...",3,negative,DISCOUNT,The review highlights wonderful views and a great concierge experience but ultimately expresses disappointment with the concierge staff.,manhattan,SORRY_2026,neutral,,,,,,,,,,,,
61eb5ca8-f597-4812-a3aa-e54d8817762c,bait switch live distance away airport stayed airp...,2,negative,DISCOUNT,The review expresses dissatisfaction with the hotel's misleading information about location and additional parking charges.,radisson,SORRY_2026,negative,,,,,,,,,,,,
6889d196-468f-456d-a9d9-4d8295bbf019,"love, family travelled riu bambu twice august 2001...",1,negative,DISCOUNT,"The reviewer expresses a strong affection for Riu Bambu, highlighting it as an amazing place to stay and indicating plans to return.",puerto vallarta,SORRY_2026,negative,,,,,,,,,,,,
1b50c6a4-7c12-4277-9dc4-f3c7db8a7c0b,kindergarten crack nice sprawling resort think sin...,3,neutral,DISCOUNT,The review mentions a nice sprawling resort but lacks clear positive or negative sentiment overall.,arizona,SORRY_2026,neutral,,,,,,,,,,,,
7a31a8bc-acce-450a-b222-6e7a671ec474,wonderful vacation barcelo bavaro caribe punta can...,5,positive,RECOMMENDATION,"The review highlights a wonderful vacation experience at Barcelo Bavaro Caribe, praising the friendly staff, clean rooms, beautiful grounds, and ample activities and food options.","punta cana, bahama",,positive,Barcelona,Spain,RAG_Activity_Match,"City tour, Nightlife tour, Food tasting",Varna,Bulgaria,RAG_Activity_Match,"Beach day, Nightlife tour",Bodrum,Turkey,RAG_Activity_Match,"Beach club visit, Boat excursion"
52c0130f-38b7-4587-9c49-94a14f0ecaf1,really great pricey wife looking hotel l.a. rememb...,5,positive,RECOMMENDATION,"The hotel offers a great experience with modern rooms, an amazing location, and excellent staff, despite being pricey.","hollywood renaissance, hollywood, experience.i",,positive,Paris,France,RAG_Activity_Match,"Museum visit, Wine tasting",Lyon,France,RAG_Activity_Match,"Gastronomic tour, Historic center stroll",Verona,Italy,RAG_Activity_Match,"Opera at the Arena, Historic center walk"
112c8b5a-fc37-4e04-a691-d873aa7d3662,bad experience new york restaurant went ritz break...,1,negative,DISCOUNT,"The reviewer had a bad experience with the breakfast service at the hotel restaurant, citing poor food quality and service issues.","new york weekend, new york",SORRY_2026,negative,,,,,,,,,,,,
5cd06f06-9a2c-43dd-a0cb-314714f06504,ritz new orleans overlooks small stuff stayed hote...,3,negative,DISCOUNT,"The review highlights disappointing housekeeping and attention to detail at the Ritz New Orleans, leading to a negative overall impression.",new orleans,SORRY_2026,neutral,,,,,,,,,,,,
f9b0b8bb-a22e-4743-9337-d0853fe64f24,"great location, great lobby, rialto ferran main sh...",2,negative,DISCOUNT,The hotel has a great location but suffers from significant issues with room quality and maintenance.,rialto,SORRY_2026,negative,,,,,,,,,,,,
24292915-716d-436f-b393-bcb4b3db95bb,"risk, start trip dr year not expecting luxurious k...",1,negative,DISCOUNT,"The review expresses disappointment with the overbooked resort, poor food options, unfriendly staff, and overcrowded beach, overshadowing any positive aspects.",,SORRY_2026,negative,,,,,,,,,,,,
2c4e902a-4d3d-46d7-a495-872378e8e6df,choice took clients attend international conferenc...,1,negative,DISCOUNT,"The hotel experience was marred by old interiors, a smoky room, and issues with missing money, leading to a disappointing stay.",bali,SORRY_2026,negative,,,,,,,,,,,,
5babad40-a955-4f0d-9629-df10fed53bb2,"carefull make reservation, wish stayed marriott, r...",1,negative,DISCOUNT,The review describes a frustrating experience with reservation issues and unexpected charges at Marriott.,marriott,SORRY_2026,negative,,,,,,,,,,,,
2764625f-26d4-466c-a07b-4c0c3f663a9f,"disappointing positive quality location, price pla...",1,negative,DISCOUNT,"The hotel had a great location and price, but the service was terrible and the room was unimpressive.",,SORRY_2026,negative,,,,,,,,,,,,
287f6b86-a3a0-4e48-a40b-2abde7edc578,"nice not price, stayed night anniversary, maybe 4 ...",3,neutral,DISCOUNT,"The hotel has both positive aspects like a comfortable bed and convenient location, but also several drawbacks including noise issues and unfriendly staff.",,SORRY_2026,neutral,,,,,,,,,,,,
d6a2706b-1b40-4e4f-b616-ec32265a40b4,friendly hotel booked directly hotel website got g...,4,positive,RECOMMENDATION,"The hotel offers a friendly atmosphere, helpful staff, and a great location for exploring Paris.",paris,,positive,Paris,France,NER_Location_Match,"Museum visit, Wine tasting",Toulouse,France,RAG_Activity_Match,"City tour, Food market visit",Nice,France,RAG_Activity_Match,"Beach day, Museum visit"
88c32a4a-339c-4d5d-b9dc-4f73afa62a24,"big city needs hotel totally enjoyed stay mario, l...",5,positive,RECOMMENDATION,"The reviewer had a great stay with a perfect location, helpful staff, and good breakfast, despite a minor issue with light bulbs.",madrid,,positive,Madrid,Spain,NER_Location_Match,"Cultural show (Flamenco), Food tasting",Madrid,Spain,NER_Location_Match,"Prado Museum visit, Tapas crawl",Granada,Spain,RAG_Activity_Match,"Alhambra visit, Flamenco show"
3aa500f7-e98b-4404-a640-38cd660463e4,"nice not 5 star, nice resort work do.there not lar...",3,negative,DISCOUNT,"The resort has several overlooked details and issues that detract from the overall experience, despite some positive aspects like helpful staff and a good spa.",muster.rjfnew jersey,SORRY_2026,neutral,,,,,,,,,,,,
a235bbb4-a73c-40d4-810a-95197410fda5,great location just spent 3 nights rialto hotel bu...,4,positive,RECOMMENDATION,"The hotel offers a great location, comfortable accommodations, and a pleasant breakfast experience.","rialto, las, las ramblas",,positive,Seville,Spain,RAG_Activity_Match,"Cathedral tour, River cruise",Barcelona,Spain,RAG_Activity_Match,"City tour, Nightlife tour, Food tasting",Seville,Spain,RAG_Activity_Match,"Cathedral visit, Cultural show (Flamenco)"
e9b9337f-3bfc-4ac9-bdac-d750e8969aef,horrible service horrible casino horrible hotel in...,1,negative,DISCOUNT,"The review describes a very disappointing experience at the hotel, highlighting poor service, issues with the casino, and overall dissatisfaction.",san juan,SORRY_2026,negative,,,,,,,,,,,,
0685ce49-d77b-4dda-997f-a29602237797,nearly superb 2 minor gripes luxembourg parc worth...,4,positive,RECOMMENDATION,"The hotel has a superb location and friendly atmosphere, but there are minor issues with room size and breakfast service.","london, uk, paris, luxembourg",,positive,Paris,France,NER_Location_Match,"Museum visit, Wine tasting",Lyon,France,RAG_Activity_Match,"Gastronomic tour, Historic center stroll",Brussels,Belgium,RAG_Activity_Match,"Chocolate tasting, Beer tour"
18e41129-01c7-44b3-909b-a7a7f24b43b1,poor hotel stayed goodwood park 2 days booked inte...,2,negative,DISCOUNT,"The hotel experience was disappointing due to poor service, noise disturbances, and inadequate amenities.",,SORRY_2026,negative,,,,,,,,,,,,
448c4b70-5658-438c-9b75-fd8b1c5d523e,beautiful hotel beautiful hotel balcony like deck ...,5,positive,RECOMMENDATION,"The hotel is beautiful with exceptional bedding and a good location, making it worth the price despite some tight staff.",,,positive,Budapest,Hungary,RAG_Activity_Match,"Thermal spa visit, Danube river cruise",Monaco,Monaco,RAG_Activity_Match,"Casino visit, Yacht harbor tour",Budapest,Hungary,RAG_Activity_Match,"Thermal bath visit, Nightlife tour"
bbe7eebe-dd13-4cb8-9be5-cf633e2fc44a,resort rooms run outdated natura park 22-27. groun...,2,negative,DISCOUNT,"The resort has beautiful grounds but the outdated rooms, lack of air conditioning, and numerous bugs led to a disappointing experience.","chicago, wisconsin, punta cana",SORRY_2026,negative,,,,,,,,,,,,
8ae2471f-cb13-4016-b1c5-956f6d3d910b,"okay probably better, hotel conveniently located s...",3,neutral,DISCOUNT,The hotel has a convenient location for sightseeing but has narrow rooms with clunky furniture and noise issues from the street.,,SORRY_2026,neutral,,,,,,,,,,,,
18df3e1b-d8a5-4c5d-9564-5b3516d4e560,loved views duomo campanile room completed trip it...,5,positive,RECOMMENDATION,"The hotel offers stunning views, friendly management, spacious rooms, and a delightful breakfast experience, making it highly recommended.",italy,,positive,Rome,Italy,NER_Location_Match,"Museum visit, Cooking class",Venice,Italy,NER_Location_Match,"Gondola ride, Museum visit",Florence,Italy,NER_Location_Match,"Art gallery tour, Cooking class"
4c65f1e6-2d70-4b5d-9088-5fe65ff14454,"horrible experience not stay, car broken lot stole...",1,negative,DISCOUNT,"The review describes a horrible experience with car theft and a bad neighborhood, leading to a strong recommendation against staying at the hotel.",dallas,SORRY_2026,negative,,,,,,,,,,,,
b91025e1-9944-4281-8396-58926b42c7a7,great workers bad management ok start begining bus...,3,negative,DISCOUNT,"The hotel experience was marred by poor management and logistical issues, despite some positive interactions with the staff.",,SORRY_2026,neutral,,,,,,,,,,,,
fb9a86c1-a63e-452b-b30a-2c881825f715,ideal location travelled autumn london river festi...,5,positive,RECOMMENDATION,"The hotel offers an ideal location, helpful staff, and comfortable rooms, making it a great choice for visiting the river festival in London.",london,,positive,Frankfurt,Germany,RAG_Activity_Match,"Skyline tour, Museum Embankment visit",Budapest,Hungary,RAG_Activity_Match,"Thermal spa visit, Danube river cruise",Rotterdam,Netherlands,RAG_Activity_Match,"Architecture tour, Harbor cruise"
89149806-dbc9-4447-8427-785785fcbff5,great place relax not 5 star went girls long weeke...,4,positive,RECOMMENDATION,"The hotel offers beautiful grounds and good service, but does not meet 5-star expectations due to room quality and slow service.","los olos, inn, casitas",,positive,Malaga,Spain,RAG_Activity_Match,"Beach day, Tapas tour",Malaga,Spain,RAG_Activity_Match,"Beach day, Picasso Museum visit",Seville,Spain,RAG_Activity_Match,"Cathedral tour, River cruise"
9bd66117-4022-4416-97a8-f405a8fa1a6a,"noisy, having just returned staying night hotel fe...",1,negative,DISCOUNT,"The review expresses dissatisfaction with noise, bed size, staff service, and overall experience, leading to a negative impression of the hotel.",barcelona day,SORRY_2026,negative,,,,,,,,,,,,
efe5b03b-9e87-4fb2-b244-b4ad0e501af1,"nice lobby, lousy service, dirty rooms, bed bugs, ...",2,negative,DISCOUNT,"The hotel has a nice lobby but suffers from consistently dirty rooms, terrible service, and a bed bug infestation.",,SORRY_2026,negative,,,,,,,,,,,,
17ab7d6e-3d2f-4e6f-8d4c-d191d25e2f5d,"nice boutique hotel stayed 5 nights, rooms nice cl...",5,positive,RECOMMENDATION,The hotel is a nice boutique option with clean rooms and a good central location in Singapore.,singapore,,positive,Bucharest,Romania,RAG_Activity_Match,"Palace of Parliament tour, Historic center visit",Istanbul,Turkey,RAG_Activity_Match,"City tour, Boat ride on the Bosphorus",Budapest,Hungary,RAG_Activity_Match,"Thermal bath visit, Nightlife tour"
e062261a-f98f-4e9a-85a8-556e0079c6f0,"fantastic, husband stayed hotel brighton 30th birt...",5,positive,RECOMMENDATION,"The hotel offers spectacular views and helpful staff, making it highly recommended despite a minor issue with housekeeping.",brighton,,positive,Paris,France,RAG_Activity_Match,"Museum visit, Wine tasting",Nice,France,RAG_Activity_Match,"Beach day, Museum visit",Lyon,France,RAG_Activity_Match,"Gastronomic tour, Historic center stroll"
e5d19865-3d4c-413a-9bd8-9ea44d738d49,pulitzer ok poor housekeeping booked pulitzer base...,3,negative,DISCOUNT,"The hotel has a great location and decor, but poor housekeeping and untrained staff detract from the experience.",,SORRY_2026,neutral,,,,,,,,,,,,
037ff665-e721-498d-8db3-c24b513af00b,"grubby dated description hotel far reality, paid e...",2,negative,DISCOUNT,"The hotel is described as grubby and dated, with unpleasant odors and a lack of cleanliness, leading to a negative overall impression.",,SORRY_2026,negative,,,,,,,,,,,,
e17aa7bc-5069-4a54-9a07-74610c28839d,"modern life stayed soho boyfriend long weekend, gr...",4,positive,RECOMMENDATION,"The hotel stay was enjoyable, but there was a significant issue with the lighting for makeup.",,,positive,Mykonos,Greece,RAG_Activity_Match,"Beach party, Boutique shopping",Barcelona,Spain,RAG_Activity_Match,"City tour, Nightlife tour, Food tasting",Limassol,Cyprus,RAG_Activity_Match,"Beach day, Castle visit"
c71ab3de-d8b7-4c39-b1ca-4ea4eb2973a4,good location great service typhoon little dissapp...,4,positive,RECOMMENDATION,"The hotel offers a great location, fantastic food, spacious and clean rooms, and excellent service, despite some minor drawbacks.",,,positive,Budapest,Hungary,RAG_Activity_Match,"Thermal bath visit, Nightlife tour",Budapest,Hungary,RAG_Activity_Match,"Thermal bath visit, Ruin bar tour",Limassol,Cyprus,RAG_Activity_Match,"Beach day, Castle visit"
961623ff-c33a-4403-bd7f-96bb18a7102c,"disappointing stayed hotel zoo long weekend, booke...",2,negative,DISCOUNT,"The hotel experience was disappointing due to small rooms, poor lighting, and constant disturbances during breakfast.",,SORRY_2026,negative,,,,,,,,,,,,
a853a6b9-e9cb-4400-818d-bf3dfda36bf2,"hold agree staff hotel outstanding, let focus thin...",3,negative,DISCOUNT,"The hotel experience was disappointing due to issues with room temperature, bathtub size, and bed comfort.",,SORRY_2026,neutral,,,,,,,,,,,,
8b9a89bf-ed6c-4c01-ba15-ee3ad383cab5,"no no n't, went read reviews spared, isla verde ro...",1,negative,DISCOUNT,"The review expresses dissatisfaction with the hotel's location and safety, despite mentioning some positive aspects of the accommodations.",,SORRY_2026,negative,,,,,,,,,,,,
e00bd646-cf56-45c9-9815-267ff19d1199,"great location, recently spent 6 nights kuta lagoo...",3,negative,DISCOUNT,"The hotel has a great location and excellent breakfast, but issues with cleanliness, noise, and overall lack of quietness detract from the experience.",,SORRY_2026,neutral,,,,,,,,,,,,
de6ecdb9-de8e-44ae-8402-32bafee74b3c,rip resturant average hotel rip resturantbooked ro...,2,negative,DISCOUNT,The hotel experience was disappointing due to poor restaurant service and unexpected charges.,,SORRY_2026,negative,,,,,,,,,,,,
0b5b7ad9-3bb2-46fd-b90c-d385b2f50133,not good place carribe hilton business conference ...,1,negative,DISCOUNT,"The review describes a series of issues with the hotel experience, including delays in room availability, poor room conditions, faulty phones, and unhelpful staff.",,SORRY_2026,negative,,,,,,,,,,,,
1b81b0eb-0f47-4c7a-8bb4-9376b875c54a,good mid-range hotel great staff prepared use publ...,3,neutral,DISCOUNT,"The hotel has good staff and clean rooms, but its location is not ideal for accessing central Berlin.",berlin,SORRY_2026,neutral,,,,,,,,,,,,
035b058a-db46-45ca-bd1d-b8ee9db3ddfb,hotel mela just returned week end new york stayed ...,4,positive,RECOMMENDATION,"The reviewer had a pleasant stay at Hotel Mela, appreciating the clean, well-appointed rooms and friendly staff.",new york,,positive,Mykonos,Greece,RAG_Activity_Match,"Beach party, Boutique shopping",Mykonos,Greece,RAG_Activity_Match,"Beach parties, Boat excursion",Milan,Italy,RAG_Activity_Match,"Fashion district walk, Duomo rooftop tour"
7a53564f-b3b3-4c17-a8f5-3818c2369ba5,"lovely place, stayed boyfriend 3 nights standard d...",4,positive,RECOMMENDATION,"The hotel is a lovely and clean place with spacious rooms, friendly staff, and good amenities.",,,positive,Budapest,Hungary,RAG_Activity_Match,"Thermal bath visit, Nightlife tour",Budapest,Hungary,RAG_Activity_Match,"Thermal spa visit, Danube river cruise",Limassol,Cyprus,RAG_Activity_Match,"Beach day, Castle visit"
751e3148-e07c-459c-8918-b1bfdbfb27db,sorry ca n't recommend friends family spent week h...,3,negative,DISCOUNT,"The hotel has a great location and some accommodating staff, but the negative experiences with air conditioning and unprofessional management overshadow the positives.",,SORRY_2026,neutral,,,,,,,,,,,,
cb19926c-d5e1-4250-8ade-d0006d2d6697,"just returned stay ayre hotel, nothing complain, r...",3,neutral,DISCOUNT,"The review mentions both positive aspects of the stay, such as a clean and roomy bathroom, and negative aspects like the lobby and elevator conditions, leading to a neutral overall sentiment.",las,SORRY_2026,neutral,,,,,,,,,,,,
cb4b711d-e30a-477c-9dd9-5eea331b23c7,"location location, location family stayed deluxe r...",5,positive,RECOMMENDATION,"The hotel offers a lovely room with a great location and plentiful breakfast, making it highly recommended.",,,positive,Vienna,Austria,RAG_Activity_Match,"Opera visit, Schnitzel tasting",Verona,Italy,RAG_Activity_Match,"Opera at the Arena, Historic center walk",Verona,Italy,RAG_Activity_Match,"Amphitheater opera, Historic center walk"
548c9a45-f54c-4666-8a06-15d55419a437,clean hotel florence hotel good clean facilities q...,4,positive,RECOMMENDATION,"The hotel in Florence offers clean facilities, a good location, and kind staff, despite some minor issues.",italy,,positive,Rome,Italy,NER_Location_Match,"Museum visit, Cooking class",Venice,Italy,NER_Location_Match,"Gondola ride, Museum visit",Florence,Italy,NER_Location_Match,"Art gallery tour, Cooking class"
f74fb117-ebd3-4881-89a1-549ce0cd14d8,perfect location happy stay comfort suites room su...,4,positive,RECOMMENDATION,"The hotel offers a perfect location, comfortable rooms, and a wonderful breakfast, despite a minor issue with the TV.",,,positive,Doha,Qatar,RAG_Activity_Match,"Souq Waqif visit, Museum of Islamic Art",Jeddah,Saudi Arabia,RAG_Activity_Match,"Historic Al-Balad tour, Seafront walk",Bilbao,Spain,RAG_Activity_Match,"Guggenheim Museum visit, Food tasting"
77abe6d5-7918-4a1b-a3d6-f6345722ce18,"got broken just got ifavillas bavero, room overloo...",2,negative,DISCOUNT,"The hotel experience was marred by construction noise, a burglary, and maintenance issues, despite some friendly staff and a good location.",,SORRY_2026,negative,,,,,,,,,,,,
b5955c38-f41a-4519-abeb-dae90e9884a0,"good thing hotel location, good thing hotel locati...",1,negative,DISCOUNT,"The hotel had a good location, but the room was not clean, and the staff were unhelpful, leading to a disappointing stay.",,SORRY_2026,negative,,,,,,,,,,,,
39f98c04-1625-4794-bb06-1ebe57b9c472,miss hotel grubby.breakfast served cramped conditi...,1,negative,DISCOUNT,"The hotel was dirty, the breakfast was of poor quality, and the air conditioning was not properly controlled.",,SORRY_2026,negative,,,,,,,,,,,,
d1d7053d-8942-4389-b813-00cfe3d51a9a,"lovely needs freshened, stayed 2 nights noticed th...",3,neutral,DISCOUNT,"The hotel has a lovely property and wonderful staff, but some areas need maintenance and cleanliness improvements.",,SORRY_2026,neutral,,,,,,,,,,,,
2260639c-5b31-4d0d-8175-e29453c88262,"terrible service, arrived hotel overbooked cancele...",1,negative,DISCOUNT,"The review describes a frustrating experience with terrible service, an overbooked hotel, and an unhelpful staff member.",,SORRY_2026,negative,,,,,,,,,,,,
cab54509-5a3a-44a3-b864-349cbca0ea22,wonderful location great beds pretty rooms inn mar...,5,positive,RECOMMENDATION,"The hotel offers a wonderful location, comfortable beds, and friendly staff, making for a great stay despite the rainy weather.",seattle,,positive,Bilbao,Spain,RAG_Activity_Match,"Guggenheim Museum visit, Food tasting",Seville,Spain,RAG_Activity_Match,"Cathedral tour, River cruise",Seville,Spain,RAG_Activity_Match,"Cathedral visit, Cultural show (Flamenco)"
bf539a6f-ecba-4a06-b2f0-4a38c8e3ff14,nice room stayed 3 nights week feb 2008 wonderful ...,4,positive,RECOMMENDATION,"The review mentions both positive aspects of the room and location, but also highlights several negative experiences with upgrades, services, and the lobby.","taiwan, beijing",,positive,Berlin,Germany,RAG_Activity_Match,"Berlin Wall memorial, Street art tour",Bucharest,Romania,RAG_Activity_Match,"Palace of Parliament tour, Historic center visit",Budapest,Hungary,RAG_Activity_Match,"Thermal bath visit, Nightlife tour"
9eb668ba-d4d4-4918-91c8-deaae6eea625,nice rooms not 4* experience hotel monaco seattle ...,3,negative,DISCOUNT,The hotel experience was disappointing due to multiple issues with service and amenities despite some positive aspects of the room.,"monaco, seattle",SORRY_2026,neutral,,,,,,,,,,,,
19c8fba4-86f6-4d75-a73c-9f8f17b4355e,"nice beach complex looks nice looks deceiving, roo...",2,negative,DISCOUNT,"The hotel had a nice beach complex, but the rooms had multiple issues including leaks, musty smells, and mosquito problems, leading to a disappointing experience.",,SORRY_2026,negative,,,,,,,,,,,,
1946579e-3327-434b-8aa8-63924ea06558,"old rude blah reason stayed jacuzzi suite, wish st...",1,negative,DISCOUNT,"The hotel has outdated facilities, rude staff, and additional costs, leading to a disappointing experience.",,SORRY_2026,negative,,,,,,,,,,,,
2f48ecb7-ebdc-4880-830a-29135a73e790,"worse hotels berlin, location hotel great like dul...",2,negative,DISCOUNT,"The review describes a very unpleasant experience at the hotel, highlighting issues with the location, staff interactions, and overall service.",berlin,SORRY_2026,negative,,,,,,,,,,,,
9b37c351-939f-421a-95a6-21931a2a8634,"great location n't stay, harbor view room view gre...",3,negative,DISCOUNT,"The hotel has a great location, but the rooms are small, noisy, and not as impressive as advertised.",,SORRY_2026,neutral,,,,,,,,,,,,
d042ef0d-6a05-4abd-a31a-584033d396f4,special place college daughter vacationed copamari...,5,positive,RECOMMENDATION,"The review highlights a wonderful experience at Copamarina with a safe environment, engaging staff, comfortable accommodations, and enjoyable amenities, despite some minor drawbacks.",,,positive,Malaga,Spain,RAG_Activity_Match,"Beach day, Picasso Museum visit",Corfu,Greece,RAG_Activity_Match,"Beach day, Old Town stroll",Malaga,Spain,RAG_Activity_Match,"Beach day, Tapas tour"
ac182e26-1b5f-4884-94e9-927e89209659,adequate/for expense accounts stayed weekend octob...,2,negative,DISCOUNT,"The review highlights issues with hidden charges and high fees, indicating dissatisfaction with the hotel's pricing and management practices.",,SORRY_2026,negative,,,,,,,,,,,,
3ff0461d-3738-4fef-9b6b-d9a046563dfa,love berlin mark hotel hiwe stayed hotel twice sta...,3,positive,RECOMMENDATION,"The hotel offers great value for money with a fantastic location and breakfast, despite lacking air conditioning.",berlin,,neutral,Berlin,Germany,NER_Location_Match,"Museum Island visit, Nightlife tour",Berlin,Germany,NER_Location_Match,"Berlin Wall memorial, Street art tour",Frankfurt,Germany,RAG_Activity_Match,"Skyline tour, Museum Embankment visit"
fbe23f23-6323-4945-9714-3f99a225aae0,"worst hotel stayed world, foolishly ignored commen...",1,negative,DISCOUNT,"The reviewer had a terrible experience at the hotel, citing issues with heat, noise from a drunken group, and poor service.","tripadvisor, edmonton alberta",SORRY_2026,negative,,,,,,,,,,,,
077b8f1f-e7eb-44bc-8e64-2c60373b81b4,great disappointment agonized finding moderately-p...,2,negative,DISCOUNT,"The reviewer experienced significant disappointment with the hotel's service, room conditions, and overall comfort during their stay in London.","london, scotland",SORRY_2026,negative,,,,,,,,,,,,
27330a08-2ed3-4e58-8cf2-1fdfe88508d7,just like family hotel casci truly warm friendly e...,5,positive,RECOMMENDATION,"Hotel Casci offers a warm and friendly environment with spacious, clean rooms and delicious breakfasts, making it a highly recommended choice for travelers in Florence.",,,positive,Florence,Italy,RAG_Activity_Match,"Uffizi Gallery visit, Gelato tasting",Florence,Italy,RAG_Activity_Match,"Art gallery tour, Cooking class",Pisa,Italy,RAG_Activity_Match,"Leaning Tower visit, Cycling tour"
17508417-dedf-4cf8-8e8a-46039c560243,"expected good location tourists issues, desk doesn...",3,neutral,DISCOUNT,"The review mentions both positive aspects like location and views, as well as negative experiences with service and check-in issues.",,SORRY_2026,neutral,,,,,,,,,,,,
75d4b3d1-3b3d-4294-95d7-b3b684209681,not 3 star stayed hotel 2 nights like reviews quit...,2,negative,DISCOUNT,"The reviewer was disappointed with their stay due to issues with room assignments, staff attitude, and lack of facilities.",,SORRY_2026,negative,,,,,,,,,,,,
911e4d18-8f2a-4134-91e5-2a9e5428c0d0,"pleasant surprise great stay, reserved quad room w...",5,positive,RECOMMENDATION,"The hotel stay was a pleasant surprise with a spacious room, polite staff, and a convenient location.",,,positive,Innsbruck,Austria,RAG_Activity_Match,"Cable car ride, Old Town visit",Bucharest,Romania,RAG_Activity_Match,"Palace of Parliament tour, Historic center visit",Doha,Qatar,RAG_Activity_Match,"Souq Waqif visit, Museum of Islamic Art"
