review_id,review_snippet,score,pred_sentiment,action,summary,ner_locations,Discount_Code,true_sentiment,sentiment_match,Rec_1_Ref_ID,Rec_1_City,Rec_1_Country,Rec_1_Reason,Rec_1_Activities,Rec_2_Ref_ID,Rec_2_City,Rec_2_Country,Rec_2_Reason,Rec_2_Activities,Rec_3_Ref_ID,Rec_3_City,Rec_3_Country,Rec_3_Reason,Rec_3_Activities
99477050-90d4-4914-aadd-1eb1bf74c232,great base seeing bejing stayed hotel 3 nights whi...,3,positive,RECOMMENDATION,"The hotel provided a great base for exploring Beijing with clean and comfortable rooms, helpful staff, and a good breakfast selection.",bejing,,neutral,False,58.0,Brussels,Belgium,RAG_Activity_Match,"Chocolate tasting, Beer tour",71.0,Basel,Switzerland,RAG_Activity_Match,"Museum visit, Rhine River walk",31.0,Budapest,Hungary,RAG_Activity_Match,"Thermal bath visit, Nightlife tour"
bb286dfb-e791-49b4-b4e5-ac68789e68d1,not great good bad points 5 minutes walk away red ...,2,negative,DISCOUNT,"The hotel experience was poor due to a lack of cleanliness, no lift, and constant noise.",,SORRY_2025,negative,True,,,,,,,,,,,,,,,
c8927658-975b-4d25-9956-717202b5b5a1,wonderful resort nice resort beautiful gardens goo...,4,positive,RECOMMENDATION,"The resort features beautiful gardens, friendly staff, and enjoyable amenities, making for a wonderful stay.",bali,,positive,True,106.0,Varna,Bulgaria,RAG_Activity_Match,"Beach day, Nightlife tour",136.0,Bodrum,Turkey,RAG_Activity_Match,"Beach club visit, Boat excursion",74.0,Varna,Bulgaria,RAG_Activity_Match,"Beach day, Archaeological museum visit"
9949d2c3-406b-4f21-9ea0-b6331601c734,"hotel rwanda, friend stayed hotel 3 nights july 07...",2,negative,DISCOUNT,"The hotel has a good location but suffers from basic rooms, security issues, and ongoing construction.",rwanda,SORRY_2025,negative,True,,,,,,,,,,,,,,,
105a4623-5bce-4f6f-ac70-06222acaa138,nice hotel shoddy service hotel nice service reall...,2,negative,DISCOUNT,"The hotel has nice facilities, but the service is poor and the charges are excessive.","washington dc, omaha, nw marriott, nebraska, marriott",SORRY_2025,negative,True,,,,,,,,,,,,,,,
939daf12-2224-4d07-9d4f-6faf61746795,good not 4 star nice clean hotel friendly staff go...,3,positive,RECOMMENDATION,"The hotel is clean with friendly staff and a good breakfast, though the rooms are small.","barca, catalunya",,neutral,False,1.0,Barcelona,Spain,RAG_Activity_Match,"City tour, Nightlife tour, Food tasting",94.0,Malaga,Spain,RAG_Activity_Match,"Beach day, Tapas tour",21.0,Valencia,Spain,RAG_Activity_Match,"City of Arts and Sciences visit, Beach day"
22d3d8ef-e346-4b6c-aa5e-541486147432,best hotel stay not easy accomodate family 5 5 yea...,5,positive,RECOMMENDATION,The Novotel Benoa Bali provides an excellent family-friendly experience with great accommodations and amenities for children.,bali,,positive,True,106.0,Varna,Bulgaria,RAG_Activity_Match,"Beach day, Nightlife tour",58.0,Brussels,Belgium,RAG_Activity_Match,"Chocolate tasting, Beer tour",136.0,Bodrum,Turkey,RAG_Activity_Match,"Beach club visit, Boat excursion"
e86fa88d-fc58-4eed-a1cb-d6ff257a4e7e,"not pictures web site come place time, room small ...",2,negative,DISCOUNT,"The hotel has a good location and comfortable beds, but the room is small, furniture is shabby, and there is significant street noise.",,SORRY_2025,negative,True,,,,,,,,,,,,,,,
e3420c70-76e4-4f3f-9349-c6ecf88f9175,great hotel central stayed hotel d'aubusson 9 days...,5,positive,RECOMMENDATION,"The hotel offers a great central location, spacious rooms, and helpful staff, making for a pleasant stay.",,,positive,True,92.0,Lyon,France,RAG_Activity_Match,"Gastronomic tour, Historic center stroll",89.0,Toulouse,France,RAG_Activity_Match,"City tour, Food market visit",4.0,Paris,France,RAG_Activity_Match,"Museum visit, Wine tasting"
364811a5-5cf9-4eb0-885b-d53769d4a474,save money grand paradise bavaro rated 4 star hard...,1,negative,DISCOUNT,"The hotel experience was disappointing due to poor room conditions, unprofessional staff, and unsatisfactory food quality.",,SORRY_2025,negative,True,,,,,,,,,,,,,,,
806ea72b-a2a9-40ac-85fd-22798f4bd121,disappointed tourist aesthetically nice lack atten...,2,negative,DISCOUNT,"The review expresses disappointment due to poor service, limited dining options, and various issues during the stay.",,SORRY_2025,negative,True,,,,,,,,,,,,,,,
3bc55104-3dd9-4419-b401-5f8630e1b111,great location booked reading reviews site main no...,3,neutral,DISCOUNT,"The hotel has a great location and friendly staff, but the room was tiny and lacked basic toiletries.",,SORRY_2025,neutral,True,,,,,,,,,,,,,,,
e59188f6-c976-43ac-9c56-eb78be42fc48,good value money london note 1st time travelers uk...,4,positive,RECOMMENDATION,"The hotel offers good value for money with a quiet location and enjoyable breakfast, making it suitable for first-time travelers.","uk, london",,positive,True,69.0,Frankfurt,Germany,RAG_Activity_Match,"Skyline tour, Museum Embankment visit",148.0,Budapest,Hungary,RAG_Activity_Match,"Thermal bath visit, Ruin bar tour",1.0,Barcelona,Spain,RAG_Activity_Match,"City tour, Nightlife tour, Food tasting"
8f234497-a815-4301-a68f-5e22b20c0da2,wonderful just got trip iberostar bavaro dominican...,5,positive,RECOMMENDATION,"The reviewer had a wonderful experience at Iberostar Bavaro in the Dominican Republic, enjoying the entertainment and the friendly staff.",,,positive,True,1.0,Barcelona,Spain,RAG_Activity_Match,"City tour, Nightlife tour, Food tasting",136.0,Bodrum,Turkey,RAG_Activity_Match,"Beach club visit, Boat excursion",106.0,Varna,Bulgaria,RAG_Activity_Match,"Beach day, Nightlife tour"
8f859319-d742-4760-a23a-a99ecfc5a112,"n't bother dump, door room warped room hallway stu...",1,negative,DISCOUNT,"The hotel room was dirty, poorly maintained, and did not meet expectations.",,SORRY_2025,negative,True,,,,,,,,,,,,,,,
0b8b18c9-ce56-4496-abed-437df286a74f,"n't listen reviews, husband couple just returned p...",5,positive,RECOMMENDATION,"The review highlights a wonderful experience at the resort with friendly staff, clean rooms, and enjoyable activities, despite some minor issues with dining reservations.",punta cana,,positive,True,1.0,Barcelona,Spain,RAG_Activity_Match,"City tour, Nightlife tour, Food tasting",45.0,Monaco,Monaco,RAG_Activity_Match,"Casino visit, Yacht harbor tour",106.0,Varna,Bulgaria,RAG_Activity_Match,"Beach day, Nightlife tour"
bff40c4f-cf99-43cf-a9ca-7cb5e7210266,"blissfully perfect, really n't say hotel, booked h...",5,positive,RECOMMENDATION,"The hotel provided an exceptional experience with excellent service, beautiful decor, and thoughtful amenities, making it a perfect choice for a special occasion.",paris,,positive,True,4.0,Paris,France,NER_Location_Match,"Museum visit, Wine tasting",125.0,Bordeaux,France,RAG_Activity_Match,"Wine château tour, Riverside walk",92.0,Lyon,France,RAG_Activity_Match,"Gastronomic tour, Historic center stroll"
73a55b1f-3db4-43df-a67c-edba82aff693,best weekend night wondered throwing money drain h...,5,positive,RECOMMENDATION,"The hotel provided a great experience with helpful staff, good food, and a fun atmosphere for families.",,,positive,True,18.0,Dubai,United Arab Emirates,RAG_Activity_Match,"Desert safari, Shopping spree",4.0,Paris,France,RAG_Activity_Match,"Museum visit, Wine tasting",1.0,Barcelona,Spain,RAG_Activity_Match,"City tour, Nightlife tour, Food tasting"
3a65b019-a448-4b1a-83f7-db1eb4e8f6a3,fantastic hotel staff value recommendation site hu...,5,positive,RECOMMENDATION,"The hotel offers fantastic staff, a great location, modern amenities, and a wonderful breakfast experience.","catalunya, barcelona",,positive,True,1.0,Barcelona,Spain,NER_Location_Match,"City tour, Nightlife tour, Food tasting",84.0,Bilbao,Spain,RAG_Activity_Match,"Guggenheim Museum visit, Food tasting",97.0,Bilbao,Spain,RAG_Activity_Match,"Guggenheim Museum visit, Pinxtos tour"
ab0be32c-69b4-48d6-94f5-1f43b99fef55,"enjoyed stay stayed 4 nights, 2 rooms did n't vaca...",3,positive,RECOMMENDATION,"The hotel stay was enjoyable with clean rooms, friendly staff, and an excellent breakfast, despite some minor inconveniences.",,,neutral,False,31.0,Budapest,Hungary,RAG_Activity_Match,"Thermal bath visit, Nightlife tour",148.0,Budapest,Hungary,RAG_Activity_Match,"Thermal bath visit, Ruin bar tour",69.0,Frankfurt,Germany,RAG_Activity_Match,"Skyline tour, Museum Embankment visit"
dd1f06ba-9c04-4703-8ffe-401d8945955b,no breakfast just returned home san francisco stay...,3,negative,DISCOUNT,"The hotel lacked breakfast service as advertised, and the ongoing renovations caused discomfort due to noise and strong paint smells.",san francisco,SORRY_2025,neutral,False,,,,,,,,,,,,,,,
081132fe-817c-48b2-81d2-9798ac8d608e,great choice midtown stayed sunday night really en...,4,positive,RECOMMENDATION,"The hotel offers a great location, comfortable accommodations, and good value for the price.",marriott,,positive,True,98.0,Milan,Italy,RAG_Activity_Match,"Fashion district walk, Duomo rooftop tour",56.0,Bucharest,Romania,RAG_Activity_Match,"Palace of Parliament tour, Historic center visit",69.0,Frankfurt,Germany,RAG_Activity_Match,"Skyline tour, Museum Embankment visit"
bfc7004c-0a8a-4a91-a69f-139f59fef96a,medium yes place mixed reviews depending reviewer ...,2,negative,DISCOUNT,"The hotel has issues with staff knowledge, maintenance, and housekeeping, leading to a disappointing experience despite some positive aspects.",,SORRY_2025,negative,True,,,,,,,,,,,,,,,
87c58761-8558-40ff-bf20-0e074ed86bf8,"ritz tip trip ritz-carlton battery park, like tip ...",3,neutral,DISCOUNT,"The review highlights both positive aspects of the hotel, such as the views and rooms, and negative experiences with the concierge staff.",manhattan,SORRY_2025,neutral,True,,,,,,,,,,,,,,,
61eb5ca8-f597-4812-a3aa-e54d8817762c,bait switch live distance away airport stayed airp...,2,negative,DISCOUNT,The review expresses dissatisfaction with the hotel's misleading information about location and additional parking charges.,radisson,SORRY_2025,negative,True,,,,,,,,,,,,,,,
6889d196-468f-456d-a9d9-4d8295bbf019,"love, family travelled riu bambu twice august 2001...",1,negative,DISCOUNT,"The reviewer expresses a strong affection for Riu Bambu, highlighting it as an amazing place to stay and plans to return.",puerto vallarta,SORRY_2025,negative,True,,,,,,,,,,,,,,,
1b50c6a4-7c12-4277-9dc4-f3c7db8a7c0b,kindergarten crack nice sprawling resort think sin...,3,neutral,DISCOUNT,The review mentions a nice sprawling resort but lacks clarity and context.,arizona,SORRY_2025,neutral,True,,,,,,,,,,,,,,,
7a31a8bc-acce-450a-b222-6e7a671ec474,wonderful vacation barcelo bavaro caribe punta can...,5,positive,RECOMMENDATION,"The review highlights a wonderful vacation experience at Barcelo Bavaro Caribe, praising the friendly staff, clean rooms, beautiful grounds, and ample activities and food options.","bahama, punta cana",,positive,True,1.0,Barcelona,Spain,RAG_Activity_Match,"City tour, Nightlife tour, Food tasting",106.0,Varna,Bulgaria,RAG_Activity_Match,"Beach day, Nightlife tour",136.0,Bodrum,Turkey,RAG_Activity_Match,"Beach club visit, Boat excursion"
52c0130f-38b7-4587-9c49-94a14f0ecaf1,really great pricey wife looking hotel l.a. rememb...,5,positive,RECOMMENDATION,"The hotel offers a great location, modern rooms, and excellent service, making it a worthwhile experience despite the high price.","hollywood renaissance, experience.i, hollywood",,positive,True,4.0,Paris,France,RAG_Activity_Match,"Museum visit, Wine tasting",95.0,Verona,Italy,RAG_Activity_Match,"Amphitheater opera, Historic center walk",83.0,Verona,Italy,RAG_Activity_Match,"Opera at the Arena, Historic center walk"
112c8b5a-fc37-4e04-a691-d873aa7d3662,bad experience new york restaurant went ritz break...,1,negative,DISCOUNT,"The reviewer had a bad experience with the breakfast service at the hotel restaurant, citing poor food quality and unsatisfactory service.","new york, new york weekend",SORRY_2025,negative,True,,,,,,,,,,,,,,,
5cd06f06-9a2c-43dd-a0cb-314714f06504,ritz new orleans overlooks small stuff stayed hote...,3,negative,DISCOUNT,The review highlights disappointing housekeeping and lack of attention to small details during the stay at the Ritz New Orleans.,new orleans,SORRY_2025,neutral,False,,,,,,,,,,,,,,,
f9b0b8bb-a22e-4743-9337-d0853fe64f24,"great location, great lobby, rialto ferran main sh...",2,negative,DISCOUNT,The hotel has a great location but suffers from significant issues with room quality and maintenance.,rialto,SORRY_2025,negative,True,,,,,,,,,,,,,,,
24292915-716d-436f-b393-bcb4b3db95bb,"risk, start trip dr year not expecting luxurious k...",1,negative,DISCOUNT,"The review expresses disappointment with the overbooked resort, uncomfortable accommodations, poor food options, and unfriendly staff, leading to an overall unsatisfactory experience.",,SORRY_2025,negative,True,,,,,,,,,,,,,,,
2c4e902a-4d3d-46d7-a495-872378e8e6df,choice took clients attend international conferenc...,1,negative,DISCOUNT,"The hotel experience was marred by old interiors, a smoky room, and issues with missing money, leading to a disappointing stay.",bali,SORRY_2025,negative,True,,,,,,,,,,,,,,,
5babad40-a955-4f0d-9629-df10fed53bb2,"carefull make reservation, wish stayed marriott, r...",1,negative,DISCOUNT,"The review describes a frustrating experience with the reservation process at Marriott, highlighting discrepancies in pricing and charges that led to disappointment.",marriott,SORRY_2025,negative,True,,,,,,,,,,,,,,,
2764625f-26d4-466c-a07b-4c0c3f663a9f,"disappointing positive quality location, price pla...",1,negative,DISCOUNT,"The hotel has a good location and price, but the service is terrible and the room is unremarkable.",,SORRY_2025,negative,True,,,,,,,,,,,,,,,
287f6b86-a3a0-4e48-a40b-2abde7edc578,"nice not price, stayed night anniversary, maybe 4 ...",3,neutral,DISCOUNT,The hotel has some nice features but also several drawbacks that balance out the experience.,,SORRY_2025,neutral,True,,,,,,,,,,,,,,,
d6a2706b-1b40-4e4f-b616-ec32265a40b4,friendly hotel booked directly hotel website got g...,4,positive,RECOMMENDATION,"The hotel offers a friendly atmosphere, helpful staff, and a great location, making it a good base for exploring Paris.",paris,,positive,True,4.0,Paris,France,NER_Location_Match,"Museum visit, Wine tasting",89.0,Toulouse,France,RAG_Activity_Match,"City tour, Food market visit",92.0,Lyon,France,RAG_Activity_Match,"Gastronomic tour, Historic center stroll"
88c32a4a-339c-4d5d-b9dc-4f73afa62a24,"big city needs hotel totally enjoyed stay mario, l...",5,positive,RECOMMENDATION,"The reviewer had a great stay with a perfect location, helpful staff, and good breakfast, despite minor issues with light bulbs.",madrid,,positive,True,7.0,Madrid,Spain,NER_Location_Match,"Cultural show (Flamenco), Food tasting",151.0,Madrid,Spain,NER_Location_Match,"Prado Museum visit, Tapas crawl",54.0,Granada,Spain,RAG_Activity_Match,"Alhambra visit, Flamenco show"
3aa500f7-e98b-4404-a640-38cd660463e4,"nice not 5 star, nice resort work do.there not lar...",3,neutral,DISCOUNT,The resort has some nice aspects but also numerous overlooked details and issues that detract from the overall experience.,muster.rjfnew jersey,SORRY_2025,neutral,True,,,,,,,,,,,,,,,
a235bbb4-a73c-40d4-810a-95197410fda5,great location just spent 3 nights rialto hotel bu...,4,positive,RECOMMENDATION,"The hotel offers a great location, comfortable accommodations, and a pleasant breakfast experience.","las, rialto, las ramblas",,positive,True,132.0,Seville,Spain,RAG_Activity_Match,"Cathedral tour, River cruise",1.0,Barcelona,Spain,RAG_Activity_Match,"City tour, Nightlife tour, Food tasting",32.0,Seville,Spain,RAG_Activity_Match,"Cathedral visit, Cultural show (Flamenco)"
e9b9337f-3bfc-4ac9-bdac-d750e8969aef,horrible service horrible casino horrible hotel in...,1,negative,DISCOUNT,"The review describes a very disappointing experience at the hotel, highlighting poor service, issues with the casino, and overall dissatisfaction.",san juan,SORRY_2025,negative,True,,,,,,,,,,,,,,,
0685ce49-d77b-4dda-997f-a29602237797,nearly superb 2 minor gripes luxembourg parc worth...,4,positive,RECOMMENDATION,"The hotel has a superb location and friendly atmosphere, but minor issues with room size and breakfast service detract from the overall experience.","uk, london, paris, luxembourg",,positive,True,4.0,Paris,France,NER_Location_Match,"Museum visit, Wine tasting",92.0,Lyon,France,RAG_Activity_Match,"Gastronomic tour, Historic center stroll",58.0,Brussels,Belgium,RAG_Activity_Match,"Chocolate tasting, Beer tour"
18e41129-01c7-44b3-909b-a7a7f24b43b1,poor hotel stayed goodwood park 2 days booked inte...,2,negative,DISCOUNT,"The hotel experience was disappointing due to noise, poor service, and inadequate amenities.",,SORRY_2025,negative,True,,,,,,,,,,,,,,,
448c4b70-5658-438c-9b75-fd8b1c5d523e,beautiful hotel beautiful hotel balcony like deck ...,5,positive,RECOMMENDATION,"The hotel is beautiful with exceptional bedding and a good location, making it worth the price despite some tight staff interactions.",,,positive,True,110.0,Budapest,Hungary,RAG_Activity_Match,"Thermal spa visit, Danube river cruise",45.0,Monaco,Monaco,RAG_Activity_Match,"Casino visit, Yacht harbor tour",31.0,Budapest,Hungary,RAG_Activity_Match,"Thermal bath visit, Nightlife tour"
bbe7eebe-dd13-4cb8-9be5-cf633e2fc44a,resort rooms run outdated natura park 22-27. groun...,2,negative,DISCOUNT,"The resort has outdated rooms and amenities, with issues related to air conditioning and bugs, despite some positive aspects like beautiful grounds and nice staff.","chicago, punta cana, wisconsin",SORRY_2025,negative,True,,,,,,,,,,,,,,,
8ae2471f-cb13-4016-b1c5-956f6d3d910b,"okay probably better, hotel conveniently located s...",3,neutral,DISCOUNT,The hotel is conveniently located for sightseeing but has narrow rooms with clunky furniture and noise issues on weekends.,,SORRY_2025,neutral,True,,,,,,,,,,,,,,,
18df3e1b-d8a5-4c5d-9564-5b3516d4e560,loved views duomo campanile room completed trip it...,5,positive,RECOMMENDATION,"The hotel offers stunning views, friendly management, spacious rooms, and a delightful breakfast experience, making it highly recommended.",italy,,positive,True,2.0,Rome,Italy,NER_Location_Match,"Museum visit, Cooking class",8.0,Venice,Italy,NER_Location_Match,"Gondola ride, Museum visit",20.0,Florence,Italy,NER_Location_Match,"Art gallery tour, Cooking class"
4c65f1e6-2d70-4b5d-9088-5fe65ff14454,"horrible experience not stay, car broken lot stole...",1,negative,DISCOUNT,"The review describes a horrible experience with car theft and a bad neighborhood, leading to a strong recommendation against staying at the hotel.",dallas,SORRY_2025,negative,True,,,,,,,,,,,,,,,
b91025e1-9944-4281-8396-58926b42c7a7,great workers bad management ok start begining bus...,3,neutral,DISCOUNT,The hotel has great staff but suffers from poor management and logistical issues.,,SORRY_2025,neutral,True,,,,,,,,,,,,,,,
fb9a86c1-a63e-452b-b30a-2c881825f715,ideal location travelled autumn london river festi...,5,positive,RECOMMENDATION,"The hotel offers an ideal location with helpful staff and comfortable rooms, making it a great choice for visiting the river festival.",london,,positive,True,69.0,Frankfurt,Germany,RAG_Activity_Match,"Skyline tour, Museum Embankment visit",110.0,Budapest,Hungary,RAG_Activity_Match,"Thermal spa visit, Danube river cruise",70.0,Rotterdam,Netherlands,RAG_Activity_Match,"Architecture tour, Harbor cruise"
89149806-dbc9-4447-8427-785785fcbff5,great place relax not 5 star went girls long weeke...,4,positive,RECOMMENDATION,"The review highlights both positive aspects like beautiful grounds and good service at times, but also points out significant shortcomings in room quality and service speed, leading to an overall neutral sentiment.","inn, los olos, casitas",,positive,True,94.0,Malaga,Spain,RAG_Activity_Match,"Beach day, Tapas tour",132.0,Seville,Spain,RAG_Activity_Match,"Cathedral tour, River cruise",81.0,Malaga,Spain,RAG_Activity_Match,"Beach day, Picasso Museum visit"
9bd66117-4022-4416-97a8-f405a8fa1a6a,"noisy, having just returned staying night hotel fe...",1,negative,DISCOUNT,"The hotel experience was disappointing due to noise, a small bed, and incompetent staff.",barcelona day,SORRY_2025,negative,True,,,,,,,,,,,,,,,
efe5b03b-9e87-4fb2-b244-b4ad0e501af1,"nice lobby, lousy service, dirty rooms, bed bugs, ...",2,negative,DISCOUNT,"The hotel has a nice lobby but suffers from terrible service, dirty rooms, and a bed bug infestation.",,SORRY_2025,negative,True,,,,,,,,,,,,,,,
17ab7d6e-3d2f-4e6f-8d4c-d191d25e2f5d,"nice boutique hotel stayed 5 nights, rooms nice cl...",5,positive,RECOMMENDATION,The hotel is a nice boutique option with clean rooms and a good central location in Singapore.,singapore,,positive,True,56.0,Bucharest,Romania,RAG_Activity_Match,"Palace of Parliament tour, Historic center visit",5.0,Istanbul,Turkey,RAG_Activity_Match,"City tour, Boat ride on the Bosphorus",31.0,Budapest,Hungary,RAG_Activity_Match,"Thermal bath visit, Nightlife tour"
e062261a-f98f-4e9a-85a8-556e0079c6f0,"fantastic, husband stayed hotel brighton 30th birt...",5,positive,RECOMMENDATION,"The hotel offers spectacular views and helpful staff, making it highly recommended despite a minor issue with housekeeping.",brighton,,positive,True,4.0,Paris,France,RAG_Activity_Match,"Museum visit, Wine tasting",19.0,Nice,France,RAG_Activity_Match,"Beach day, Museum visit",92.0,Lyon,France,RAG_Activity_Match,"Gastronomic tour, Historic center stroll"
e5d19865-3d4c-413a-9bd8-9ea44d738d49,pulitzer ok poor housekeeping booked pulitzer base...,3,negative,DISCOUNT,"The hotel has a great location and decor, but poor housekeeping and untrained staff mar the experience.",,SORRY_2025,neutral,False,,,,,,,,,,,,,,,
037ff665-e721-498d-8db3-c24b513af00b,"grubby dated description hotel far reality, paid e...",2,negative,DISCOUNT,"The hotel is described as grubby and dated, with a stale smell and poor quality furnishings, leading to a negative impression overall.",,SORRY_2025,negative,True,,,,,,,,,,,,,,,
e17aa7bc-5069-4a54-9a07-74610c28839d,"modern life stayed soho boyfriend long weekend, gr...",4,positive,RECOMMENDATION,"The hotel stay was enjoyable, but there was an issue with the lighting for makeup.",,,positive,True,130.0,Mykonos,Greece,RAG_Activity_Match,"Beach party, Boutique shopping",1.0,Barcelona,Spain,RAG_Activity_Match,"City tour, Nightlife tour, Food tasting",63.0,Limassol,Cyprus,RAG_Activity_Match,"Beach day, Castle visit"
c71ab3de-d8b7-4c39-b1ca-4ea4eb2973a4,good location great service typhoon little dissapp...,4,positive,RECOMMENDATION,"The hotel offers a great location, fantastic food, and excellent service, despite some minor drawbacks.",,,positive,True,31.0,Budapest,Hungary,RAG_Activity_Match,"Thermal bath visit, Nightlife tour",148.0,Budapest,Hungary,RAG_Activity_Match,"Thermal bath visit, Ruin bar tour",45.0,Monaco,Monaco,RAG_Activity_Match,"Casino visit, Yacht harbor tour"
961623ff-c33a-4403-bd7f-96bb18a7102c,"disappointing stayed hotel zoo long weekend, booke...",2,negative,DISCOUNT,"The hotel experience was disappointing due to a small room, poor lighting, and constant disturbances during breakfast.",,SORRY_2025,negative,True,,,,,,,,,,,,,,,
a853a6b9-e9cb-4400-818d-bf3dfda36bf2,"hold agree staff hotel outstanding, let focus thin...",3,negative,DISCOUNT,"The hotel staff was outstanding, but the room had significant issues with temperature control, a lack of a proper bathtub, and an uncomfortable bed.",,SORRY_2025,neutral,False,,,,,,,,,,,,,,,
8b9a89bf-ed6c-4c01-ba15-ee3ad383cab5,"no no n't, went read reviews spared, isla verde ro...",1,negative,DISCOUNT,"The hotel is located in an unsafe area with poor visuals and noise, despite some nice accommodations.",,SORRY_2025,negative,True,,,,,,,,,,,,,,,
e00bd646-cf56-45c9-9815-267ff19d1199,"great location, recently spent 6 nights kuta lagoo...",3,neutral,DISCOUNT,"The hotel has a great location and excellent breakfast, but issues with cleanliness and noise detract from the overall experience.",,SORRY_2025,neutral,True,,,,,,,,,,,,,,,
de6ecdb9-de8e-44ae-8402-32bafee74b3c,rip resturant average hotel rip resturantbooked ro...,2,negative,DISCOUNT,The hotel experience was disappointing due to poor restaurant service and unexpected charges.,,SORRY_2025,negative,True,,,,,,,,,,,,,,,
0b5b7ad9-3bb2-46fd-b90c-d385b2f50133,not good place carribe hilton business conference ...,1,negative,DISCOUNT,"The hotel experience was disappointing due to poor service, outdated facilities, and unresolved issues with room amenities.",,SORRY_2025,negative,True,,,,,,,,,,,,,,,
1b81b0eb-0f47-4c7a-8bb4-9376b875c54a,good mid-range hotel great staff prepared use publ...,3,neutral,DISCOUNT,"The hotel has good staff and clean rooms, but its location is not ideal for accessing central Berlin.",berlin,SORRY_2025,neutral,True,,,,,,,,,,,,,,,
035b058a-db46-45ca-bd1d-b8ee9db3ddfb,hotel mela just returned week end new york stayed ...,4,positive,RECOMMENDATION,The hotel offers small but clean and well-appointed rooms with friendly and helpful staff.,new york,,positive,True,130.0,Mykonos,Greece,RAG_Activity_Match,"Beach party, Boutique shopping",82.0,Mykonos,Greece,RAG_Activity_Match,"Beach parties, Boat excursion",98.0,Milan,Italy,RAG_Activity_Match,"Fashion district walk, Duomo rooftop tour"
7a53564f-b3b3-4c17-a8f5-3818c2369ba5,"lovely place, stayed boyfriend 3 nights standard d...",4,positive,RECOMMENDATION,"The hotel is a lovely and clean place with spacious rooms, friendly staff, and good amenities.",,,positive,True,31.0,Budapest,Hungary,RAG_Activity_Match,"Thermal bath visit, Nightlife tour",90.0,Dresden,Germany,RAG_Activity_Match,"Historic center walk, Art gallery visit",110.0,Budapest,Hungary,RAG_Activity_Match,"Thermal spa visit, Danube river cruise"
